Skool4Kidz Campus @ Yishun,0.39670592203030913,0.6071428571428571,0.4177104377104377,0.4303030303030303,,,,0.424006734006734,0.0,0.16216216216216217,0.0,1.0,0.0,1.0,1.0,1.0,0.0,0.0,1.0,0.0,1.0,1.0,0.0,0.0,1.0,1.0,1.0,0.0,1.0,1.0,1.0,1.0,1.0,1.0,1.0,1.0,1.0,1.0,1.0,1.0,0.0,1.0,1.0,0.0,1.0,1.0,0.0,0.7099053770048279,3.6867929217094053,14.632706936434541,1.4242046,103.84544,3.952684600196109,1,7.0,19.0,7.0,19.0,7.0,19.0,7.0,19.0,7.0,19.0,7.0,14.0,100.0,100.0,1,1,1,1,1,1,1,1,1,1,1,1,1,1,1,Preschool,"61 Yishun Ave 11, Singapore 768866 ","Friday, 7am to 7pm, Saturday, 7am to 2pm, Sunday, Closed, Monday, 7am to 7pm, Tuesday, 7am to 7pm, Wednesday, 7am to 7pm, Thursday, 7am to 7pm",https://www.havence.world/enquiry/skool4kidz/prospect,"https://www.google.com/maps/place/Skool4Kidz+Campus+@+Yishun/@1.4242046,103.84544,17z/data=!3m1!4b1!4m6!3m5!1s0x31da1441e5831a09:0xf8cad3397c9995d9!8m2!3d1.4242046!4d103.84544!16s%2Fg%2F11c5_6gqsp?entry=ttu",2024-04-12 04:46:46.369687,"5, 5, 3, 5, 1, 1, 4",3.4285714285714284,Closed,Closed,7am,7pm,7am,7pm,7am,7pm,7am,7pm,7am,7pm,7am,2pm,0.4177104377104377,0.4303030303030303,,,,0.424006734006734,https://skool4kidz.com.sg/fees-subsidies/,1234.68,679.63,679.63,679.63,1593.49,900.0,900.0,900.0,1.0,"https___skool4kidz_com_sg_what_teachers_say_2019_, https___skool4kidz_com_sg_skool4kidz_core_values_, https___skool4kidz_com_sg__content, https___skool4kidz_com_sg_our_programme_, https___skool4kidz_com_sg_infants_toddlers_, https___skool4kidz_com_sg_parent_testimonial_2021_, https___skool4kidz_com_sg_healthy_meals_in_skool4kidz_preschool_, https___skool4kidz_com_sg_little_giving_artists_2023_, https___skool4kidz_com_sg_about_us_, https___skool4kidz_com_sg_curriculum_programme_, https___skool4kidz_com_sg_career_, https___skool4kidz_com_sg_privacy_policy_, https___skool4kidz_com_sg_care_fund_, https___skool4kidz_com_sg_parent_testimonial_2022_, https___skool4kidz_com_sg_preschoolers_, https___skool4kidz_com_sg__page_id_17016, https___skool4kidz_com_sg_little_giving_artists_2021_, https___skool4kidz_com_sg_registration_, https___skool4kidz_com_sg_little_giving_artists_2022_, https___skool4kidz_com_sg_, https___skool4kidz_com_sg_happenings_, https___skool4kidz_com_sg_parent_testimonial_2023_, https___skool4kidz_com_sg_what_teachers_say_2022_, https___skool4kidz_com_sg_whats_new_, https___skool4kidz_com_sg_parent_testimonial_2018_, https___skool4kidz_com_sg_contact_us_feedback_, https___skool4kidz_com_sg_what_teachers_say_2020_, https___skool4kidz_com_sg_in_the_news_, https___skool4kidz_com_sg_contact_us_register_your_interest_, https___skool4kidz_com_sg_our_company_history_, https___skool4kidz_com_sg_parent_testimonial_2019_, https___skool4kidz_com_sg_enrichment_, https___skool4kidz_com_sg__, https___skool4kidz_com_sg_fees_subsidies_, https___skool4kidz_com_sg_gallery_, https___skool4kidz_com_sg_parent_testimonial_2020_, https___skool4kidz_com_sg_our_centres_, https___skool4kidz_com_sg_what_teachers_say_2021_","['bilingual_curriculum', 'chinese_curriculum', 'early_years_development_framework', 'english_curriculum', 'integrated_curriculum', 'moe', 'nurturing_early_learners_curriculum', 'reggio_emilia_approach', 'spark_certified_curriculum', 'thematic']",0.0,1.0,0.0,1.0,1.0,1.0,0.0,0.0,1.0,0.0,1.0,1.0,0.0,0.0,1.0,1.0,1.0,0.0,"['aesthetics & creative expression', 'chinese', 'digital skills', 'discovery of the word', 'english', 'language and literacy', 'math', 'moral education', 'motor skill development', 'music', 'nature', 'numeracy', 'project work', 'science', 'social & emotional development', 'speech and drama']",1.0,1.0,1.0,1.0,1.0,1.0,1.0,1.0,1.0,1.0,1.0,1.0,0.0,1.0,1.0,0.0,1.0,1.0,0.0,"['infant_care', 'playgroup', 'nursery', 'kindergarten']",1.0,1.0,1.0,1.0,1.0,3
Skool4Kidz Centre (Yishun Orchid Spring),0.44086545433024815,0.875,0.7,,,,,0.7,0.0,0.16216216216216217,0.0,1.0,0.0,1.0,1.0,1.0,0.0,0.0,1.0,0.0,1.0,1.0,0.0,0.0,1.0,1.0,1.0,0.0,1.0,1.0,1.0,1.0,1.0,1.0,1.0,1.0,1.0,1.0,1.0,1.0,0.0,1.0,1.0,0.0,1.0,1.0,0.0,0.7082053487783656,3.749241502419254,15.30977531914333,1.4216452,103.8484954,4.392673616500686,1,7.0,19.0,7.0,19.0,7.0,19.0,7.0,19.0,7.0,19.0,7.0,14.0,100.0,100.0,1,1,1,1,1,1,1,1,1,1,1,1,1,1,1,Preschool,"430A Yishun Ave 11, #01-376, Singapore 761430 ","Friday, 7am to 7pm, Saturday, 7am to 2pm, Sunday, Closed, Monday, 7am to 7pm, Tuesday, 7am to 7pm, Wednesday, 7am to 7pm, Thursday, 7am to 7pm",https://www.havence.world/enquiry/skool4kidz/prospect,"https://www.google.com/maps/place/Skool4Kidz+Preschool+@+Yishun+Orchid+Spring/@1.4216452,103.8484954,17z/data=!3m1!4b1!4m6!3m5!1s0x31da1440866cf2f5:0xd74ff074c937d546!8m2!3d1.4216452!4d103.8484954!16s%2Fg%2F11bw46w9c_?entry=ttu",2024-04-12 04:51:26.393733,"4, 5",4.5,Closed,Closed,7am,7pm,7am,7pm,7am,7pm,7am,7pm,7am,7pm,7am,2pm,0.7,,,,,0.7,https://skool4kidz.com.sg/fees-subsidies/,1234.68,679.63,679.63,679.63,1593.49,900.0,900.0,900.0,1.0,"https___skool4kidz_com_sg_what_teachers_say_2019_, https___skool4kidz_com_sg_skool4kidz_core_values_, https___skool4kidz_com_sg__content, https___skool4kidz_com_sg_our_programme_, https___skool4kidz_com_sg_infants_toddlers_, https___skool4kidz_com_sg_parent_testimonial_2021_, https___skool4kidz_com_sg_healthy_meals_in_skool4kidz_preschool_, https___skool4kidz_com_sg_little_giving_artists_2023_, https___skool4kidz_com_sg_about_us_, https___skool4kidz_com_sg_curriculum_programme_, https___skool4kidz_com_sg_career_, https___skool4kidz_com_sg_privacy_policy_, https___skool4kidz_com_sg_care_fund_, https___skool4kidz_com_sg_parent_testimonial_2022_, https___skool4kidz_com_sg_preschoolers_, https___skool4kidz_com_sg__page_id_17016, https___skool4kidz_com_sg_little_giving_artists_2021_, https___skool4kidz_com_sg_registration_, https___skool4kidz_com_sg_little_giving_artists_2022_, https___skool4kidz_com_sg_, https___skool4kidz_com_sg_happenings_, https___skool4kidz_com_sg_parent_testimonial_2023_, https___skool4kidz_com_sg_what_teachers_say_2022_, https___skool4kidz_com_sg_whats_new_, https___skool4kidz_com_sg_parent_testimonial_2018_, https___skool4kidz_com_sg_contact_us_feedback_, https___skool4kidz_com_sg_what_teachers_say_2020_, https___skool4kidz_com_sg_in_the_news_, https___skool4kidz_com_sg_contact_us_register_your_interest_, https___skool4kidz_com_sg_our_company_history_, https___skool4kidz_com_sg_parent_testimonial_2019_, https___skool4kidz_com_sg_enrichment_, https___skool4kidz_com_sg__, https___skool4kidz_com_sg_fees_subsidies_, https___skool4kidz_com_sg_gallery_, https___skool4kidz_com_sg_parent_testimonial_2020_, https___skool4kidz_com_sg_our_centres_, https___skool4kidz_com_sg_what_teachers_say_2021_","['bilingual_curriculum', 'chinese_curriculum', 'early_years_development_framework', 'english_curriculum', 'integrated_curriculum', 'moe', 'nurturing_early_learners_curriculum', 'reggio_emilia_approach', 'spark_certified_curriculum', 'thematic']",0.0,1.0,0.0,1.0,1.0,1.0,0.0,0.0,1.0,0.0,1.0,1.0,0.0,0.0,1.0,1.0,1.0,0.0,"['aesthetics & creative expression', 'chinese', 'digital skills', 'discovery of the word', 'english', 'language and literacy', 'math', 'moral education', 'motor skill development', 'music', 'nature', 'numeracy', 'project work', 'science', 'social & emotional development', 'speech and drama']",1.0,1.0,1.0,1.0,1.0,1.0,1.0,1.0,1.0,1.0,1.0,1.0,0.0,1.0,1.0,0.0,1.0,1.0,0.0,"['infant_care', 'playgroup', 'nursery', 'kindergarten']",1.0,1.0,1.0,1.0,1.0,3
"E-Bridge Pre-School Pte Ltd (592C, Montreal Link)",0.15977780456767243,1.0,0.31,0.31,,,,0.31,0.15685588840968245,0.0,0.0,1.0,0.0,1.0,1.0,1.0,1.0,1.0,1.0,0.0,1.0,1.0,0.0,0.0,1.0,1.0,1.0,0.0,1.0,1.0,1.0,1.0,1.0,1.0,1.0,0.0,1.0,1.0,1.0,1.0,0.0,1.0,1.0,0.0,1.0,1.0,0.0,0.7076356443145542,3.7750119651790746,15.062836792194704,1.450795,103.8278399,1.5920217057336834,1,7.0,19.0,7.0,19.0,7.0,19.0,7.0,19.0,7.0,19.0,7.0,12.0,100.0,100.0,1,1,1,1,1,1,1,1,1,1,1,1,1,1,1,Preschool,"Montreal Link, #01-26 Blk 592C, Singapore 760504 ","Thursday, 7am to 7pm, Friday, 7am to 7pm, Saturday, 7am to 12pm, Sunday, Closed, Monday, 7am to 7pm, Tuesday, 7am to 7pm, Wednesday, 7am to 7pm",https://www.e-bridge.edu.sg/,"https://www.google.com/maps/place/E-Bridge+Pre-School+Montreal+Link/@1.450795,103.8278399,17z/data=!3m1!4b1!4m6!3m5!1s0x31da149c9cfe07ab:0xa9fa59f8a926a905!8m2!3d1.450795!4d103.8278399!16s%2Fg%2F11by__ww6z?entry=ttu",2024-04-11 23:23:01.800382,5,5.0,Closed,Closed,7am,7pm,7am,7pm,7am,7pm,7am,7pm,7am,7pm,7am,12pm,0.31,0.31,,,,0.31,https://skoolopedia.com/app/childcare/e-bridge-preschool/e-bridge-pre-school-730573,1275,720.0,720.0,720.0,1275,720.0,720.0,720.0,1.0,"https___www_e_bridge_edu_sg_private_statement_, https___www_e_bridge_edu_sg_vision_mission_core_values_, https___www_e_bridge_edu_sg_join_us_, https___www_e_bridge_edu_sg__, https___www_e_bridge_edu_sg_our_approach, https___www_e_bridge_edu_sg_locations_, https___www_e_bridge_edu_sg_contact_us_, https___www_e_bridge_edu_sg_fees_, https___www_e_bridge_edu_sg__content, https___www_e_bridge_edu_sg_our_curriculum_, https___www_e_bridge_edu_sg_kindergarten_, https___www_e_bridge_edu_sg_curriculum_overview_, https___www_e_bridge_edu_sg_how_to_register_, https___www_e_bridge_edu_sg__page_id_1092, https___www_e_bridge_edu_sg_interactive_map_, https___www_e_bridge_edu_sg_infant_care_, https___www_e_bridge_edu_sg_founders_message_, https___www_e_bridge_edu_sg_nursery_, https___www_e_bridge_edu_sg_our_milestones_, https___www_e_bridge_edu_sg_, https___www_e_bridge_edu_sg_our_approach_","['bilingual_curriculum', 'chinese_curriculum', 'early_years_development_framework', 'english_curriculum', 'ib_pyp', 'inquiry_based', 'integrated_curriculum', 'moe', 'nurturing_early_learners_curriculum', 'reggio_emilia_approach', 'spark_certified_curriculum', 'thematic']",0.0,1.0,0.0,1.0,1.0,1.0,1.0,1.0,1.0,0.0,1.0,1.0,0.0,0.0,1.0,1.0,1.0,0.0,"['aesthetics & creative expression', 'chinese', 'digital skills', 'discovery of the word', 'english', 'language and literacy', 'math', 'motor skill development', 'music', 'nature', 'numeracy', 'project work', 'science', 'social & emotional development', 'speech and drama']",1.0,1.0,1.0,1.0,1.0,1.0,1.0,0.0,1.0,1.0,1.0,1.0,0.0,1.0,1.0,0.0,1.0,1.0,0.0,"['infant_care', 'playgroup', 'nursery', 'kindergarten']",1.0,1.0,1.0,1.0,1.0,3
Skool4Kidz Centre (Hougang Buangkok Square),0.9950748895996793,1.0,,,,,,,0.0,0.16216216216216217,0.0,1.0,0.0,1.0,1.0,1.0,0.0,0.0,1.0,0.0,1.0,1.0,0.0,0.0,1.0,1.0,1.0,0.0,1.0,1.0,1.0,1.0,1.0,1.0,1.0,1.0,1.0,1.0,1.0,1.0,0.0,1.0,1.0,0.0,1.0,1.0,0.0,0.7036876817784131,3.7782299268227337,15.274818087746095,1.3837399,103.8817824,9.914608554458564,1,7.0,19.0,7.0,19.0,7.0,19.0,7.0,19.0,7.0,19.0,7.0,14.0,100.0,100.0,1,1,1,1,1,1,1,1,1,1,1,1,1,1,1,Preschool,"Blk 992B Buangkok Link, #01-181, Singapore 532992 ","Friday, 7am to 7pm, Saturday, 7am to 2pm, Sunday, Closed, Monday, 7am to 7pm, Tuesday, 7am to 7pm, Wednesday, 7am to 7pm, Thursday, 7am to 7pm",https://skool4kidz.com.sg/our-centres/hougang-buangkok-square/,"https://www.google.com/maps/place/Skool4Kidz+Preschool+@+Hougang+Buangkok+Square/@1.3837399,103.8817824,17z/data=!3m1!4b1!4m6!3m5!1s0x31da17321a5ad1e1:0xcfe4cb4120379eb0!8m2!3d1.3837399!4d103.8817824!16s%2Fg%2F11h0b50czp?entry=ttu",2024-04-12 04:47:28.231425,5,5.0,Closed,Closed,7am,7pm,7am,7pm,7am,7pm,7am,7pm,7am,7pm,7am,2pm,,,,,,,https://skool4kidz.com.sg/fees-subsidies/,1234.68,679.63,679.63,679.63,1593.49,900.0,900.0,900.0,1.0,"https___skool4kidz_com_sg_what_teachers_say_2019_, https___skool4kidz_com_sg_skool4kidz_core_values_, https___skool4kidz_com_sg__content, https___skool4kidz_com_sg_our_programme_, https___skool4kidz_com_sg_infants_toddlers_, https___skool4kidz_com_sg_parent_testimonial_2021_, https___skool4kidz_com_sg_healthy_meals_in_skool4kidz_preschool_, https___skool4kidz_com_sg_little_giving_artists_2023_, https___skool4kidz_com_sg_about_us_, https___skool4kidz_com_sg_curriculum_programme_, https___skool4kidz_com_sg_career_, https___skool4kidz_com_sg_privacy_policy_, https___skool4kidz_com_sg_care_fund_, https___skool4kidz_com_sg_parent_testimonial_2022_, https___skool4kidz_com_sg_preschoolers_, https___skool4kidz_com_sg__page_id_17016, https___skool4kidz_com_sg_little_giving_artists_2021_, https___skool4kidz_com_sg_registration_, https___skool4kidz_com_sg_little_giving_artists_2022_, https___skool4kidz_com_sg_, https___skool4kidz_com_sg_happenings_, https___skool4kidz_com_sg_parent_testimonial_2023_, https___skool4kidz_com_sg_what_teachers_say_2022_, https___skool4kidz_com_sg_whats_new_, https___skool4kidz_com_sg_parent_testimonial_2018_, https___skool4kidz_com_sg_contact_us_feedback_, https___skool4kidz_com_sg_what_teachers_say_2020_, https___skool4kidz_com_sg_in_the_news_, https___skool4kidz_com_sg_contact_us_register_your_interest_, https___skool4kidz_com_sg_our_company_history_, https___skool4kidz_com_sg_parent_testimonial_2019_, https___skool4kidz_com_sg_enrichment_, https___skool4kidz_com_sg__, https___skool4kidz_com_sg_fees_subsidies_, https___skool4kidz_com_sg_gallery_, https___skool4kidz_com_sg_parent_testimonial_2020_, https___skool4kidz_com_sg_our_centres_, https___skool4kidz_com_sg_what_teachers_say_2021_","['bilingual_curriculum', 'chinese_curriculum', 'early_years_development_framework', 'english_curriculum', 'integrated_curriculum', 'moe', 'nurturing_early_learners_curriculum', 'reggio_emilia_approach', 'spark_certified_curriculum', 'thematic']",0.0,1.0,0.0,1.0,1.0,1.0,0.0,0.0,1.0,0.0,1.0,1.0,0.0,0.0,1.0,1.0,1.0,0.0,"['aesthetics & creative expression', 'chinese', 'digital skills', 'discovery of the word', 'english', 'language and literacy', 'math', 'moral education', 'motor skill development', 'music', 'nature', 'numeracy', 'project work', 'science', 'social & emotional development', 'speech and drama']",1.0,1.0,1.0,1.0,1.0,1.0,1.0,1.0,1.0,1.0,1.0,1.0,0.0,1.0,1.0,0.0,1.0,1.0,0.0,"['infant_care', 'playgroup', 'nursery', 'kindergarten']",1.0,1.0,1.0,1.0,1.0,3
MY World Preschool Ltd (Bukit Panjang),0.8973113350442568,1.0,0.0,,,,,0.0,0.23922757120099458,0.23513513513513506,0.0,0.0,0.0,1.0,1.0,1.0,0.0,1.0,1.0,0.0,0.0,0.0,0.0,0.0,0.0,1.0,1.0,0.0,1.0,1.0,1.0,1.0,1.0,1.0,1.0,0.0,1.0,1.0,1.0,0.0,1.0,1.0,1.0,0.0,1.0,1.0,1.0,0.7018674416257151,3.6032993491575906,14.010799934962652,1.374784,103.773705,8.940529166409005,1,7.0,19.0,7.0,19.0,7.0,19.0,7.0,19.0,7.0,19.0,100.0,100.0,100.0,100.0,1,1,1,1,1,1,1,1,1,1,1,1,1,1,1,Preschool,"Petir Rd, #01-385 Block 217, Singapore 670217 ","Friday, 7am to 7pm, Saturday, Closed, Sunday, Closed, Monday, 7am to 7pm, Tuesday, 7am to 7pm, Wednesday, 7am to 7pm, Thursday, 7am to 7pm",http://www.myworld.org.sg/,"https://www.google.com/maps/place/M.Y+World+@+Bukit+Panjang/@1.374784,103.773705,17z/data=!3m1!4b1!4m6!3m5!1s0x31da11a7c1be6363:0x5f654f7390d0df34!8m2!3d1.374784!4d103.773705!16s%2Fg%2F1pv610k12?entry=ttu",2024-04-12 01:56:43.258509,"5, 5, 5",5.0,Closed,Closed,7am,7pm,7am,7pm,7am,7pm,7am,7pm,7am,7pm,Closed,Closed,0.0,,,,,0.0,https://www.myworld.org.sg/faq/,1346.15,741.2,741.2,741.2,1737.19,981.0,981.0,981.0,1.0,"https___www_myworld_org_sg_contact_us_, https___www_myworld_org_sg_next_slide, https___www_myworld_org_sg__, https___www_myworld_org_sg_home_based_learning_, https___www_myworld_org_sg_previous_slide, https___www_myworld_org_sg_leadership_, https___www_myworld_org_sg_about_us_, https___www_myworld_org_sg_parents_communications_, https___www_myworld_org_sg_, https___www_myworld_org_sg_annual_reports_, https___www_myworld_org_sg_our_programmes_, https___www_myworld_org_sg_covid_19_guides_, https___www_myworld_org_sg_my_stories_, https___www_myworld_org_sg_faq_, https___www_myworld_org_sg_careers_, https___www_myworld_org_sg_s_t_r_o_n_g_principles_, https___www_myworld_org_sg_parents_giveback_, https___www_myworld_org_sg_our_teaching_learning_approach_, https___www_myworld_org_sg_our_learning_environment_, https___www_myworld_org_sg_our_centres_, https___www_myworld_org_sg_about_my_world_preschool_, https___www_myworld_org_sg_what_parents_say_, https___www_myworld_org_sg_newsletter_","['chinese_curriculum', 'early_years_development_framework', 'english_curriculum', 'inquiry_based', 'integrated_curriculum', 'spark_certified_curriculum', 'thematic']",0.0,0.0,0.0,1.0,1.0,1.0,0.0,1.0,1.0,0.0,0.0,0.0,0.0,0.0,0.0,1.0,1.0,0.0,"['aesthetics & creative expression', 'chinese', 'digital skills', 'discovery of the word', 'english', 'language and literacy', 'math', 'motor skill development', 'music', 'nature', 'problem-solving skills', 'project work', 'science', 'social & emotional development', 'speech and drama', 'sports']",1.0,1.0,1.0,1.0,1.0,1.0,1.0,0.0,1.0,1.0,1.0,0.0,1.0,1.0,1.0,0.0,1.0,1.0,1.0,"['infant_care', 'playgroup', 'nursery', 'kindergarten']",1.0,1.0,1.0,1.0,1.0,3
My First Skool (308C Anchorvale Rd),0.9927425290630155,0.375,0.3875,-1.0,0.3875,0.3875,0.3875,,0.23922757120099458,0.23513513513513506,0.0,0.0,0.0,1.0,1.0,1.0,0.0,0.0,1.0,0.0,1.0,1.0,0.0,0.0,0.0,1.0,1.0,0.0,1.0,1.0,1.0,1.0,1.0,1.0,1.0,0.0,1.0,1.0,1.0,1.0,0.0,1.0,1.0,0.0,1.0,0.0,0.0,0.6994147455109755,3.6125336517170523,14.28123112898141,1.3896411,103.8864004,9.89136978890226,1,7.0,19.0,7.0,19.0,7.0,19.0,7.0,19.0,7.0,19.0,7.0,14.0,100.0,100.0,1,1,1,1,1,1,1,1,1,1,1,1,1,1,1,Preschool,"Anchorvale Rd, #01-26 Blk 308C, Singapore 543308 ","Friday, 7am to 7pm, Saturday, 7am to 2pm, Sunday, Closed, Monday, 7am to 7pm, Tuesday, 7am to 7pm, Wednesday, 7am to 7pm, Thursday, 7am to 7pm",https://www.myfirstskool.com/?utm_medium=visit-website&utm_source=GMB-AVC&utm_campaign=Google&utm_term=website-button&utm_content=GMB,"https://www.google.com/maps/place/My+First+Skool+at+Blk+308C+Anchorvale+Road/@1.3896411,103.8864004,17z/data=!3m1!4b1!4m6!3m5!1s0x31da166d6c3c934d:0x1c8b4a022d66c6ad!8m2!3d1.3896411!4d103.8864004!16s%2Fg%2F1pv5_tsw0?entry=ttu",2024-04-12 01:18:53.302845,"4, 1",2.5,Closed,Closed,7am,7pm,7am,7pm,7am,7pm,7am,7pm,7am,7pm,7am,2pm,0.3875,-1.0,0.3875,0.3875,0.3875,,https://www.myfirstskool.com/fees-perks/fees/infant-fees/,1346.15,741.2,741.2,741.2,1737.18,981.0,981.0,981.0,1.0,"https___www_myfirstskool_com_our_approach_curriculum, https___www_myfirstskool_com_preschools_in_punggol, https___www_myfirstskool_com_fees_perks_promotion_, https___www_myfirstskool_com_our_approach_curriculum_, https___www_myfirstskool_com_our_centres_find_a_centre, https___www_myfirstskool_com_preschools_in_jurong, https___www_myfirstskool_com_about_us, https___www_myfirstskool_com_fees_perks, https___www_myfirstskool_com_for_parents_resources_, https___www_myfirstskool_com_about_us_awards_, https___www_myfirstskool_com_for_parents_, https___www_myfirstskool_com_our_approach_programmes_, https___www_myfirstskool_com__main, https___www_myfirstskool_com_our_centres_experience, https___www_myfirstskool_com_for_parents_calendar_, https___www_myfirstskool_com_preschools_in_ang_mo_kio, https___www_myfirstskool_com_preschools_in_toa_payoh, https___www_myfirstskool_com_our_approach_, https___www_myfirstskool_com_about_us_vision_mission_, https___www_myfirstskool_com__main_container, https___www_myfirstskool_com_about_us_news_media_, https___www_myfirstskool_com_our_approach_programmes, https___www_myfirstskool_com_teach_with_us, https___www_myfirstskool_com_register, https___www_myfirstskool_com_fees_perks_fees_, https___www_myfirstskool_com_faq, https___www_myfirstskool_com_teach_with_us_, https___www_myfirstskool_com_, https___www_myfirstskool_com_our_centres_experience_, https___www_myfirstskool_com_about_us_, https___www_myfirstskool_com_about_us_my_first_skool_, https___www_myfirstskool_com_for_parents_articles_, https___www_myfirstskool_com_our_centres_, https___www_myfirstskool_com_fees_perks_, https___www_myfirstskool_com_our_centres_find_a_centre_, https___www_myfirstskool_com_preschools_in_sengkang, https___www_myfirstskool_com_privacy_policy_","['chinese_curriculum', 'early_years_development_framework', 'english_curriculum', 'integrated_curriculum', 'moe', 'nurturing_early_learners_curriculum', 'spark_certified_curriculum', 'thematic']",0.0,0.0,0.0,1.0,1.0,1.0,0.0,0.0,1.0,0.0,1.0,1.0,0.0,0.0,0.0,1.0,1.0,0.0,"['aesthetics & creative expression', 'chinese', 'digital skills', 'discovery of the word', 'english', 'language and literacy', 'math', 'motor skill development', 'music', 'nature', 'numeracy', 'project work', 'science', 'social & emotional development']",1.0,1.0,1.0,1.0,1.0,1.0,1.0,0.0,1.0,1.0,1.0,1.0,0.0,1.0,1.0,0.0,1.0,0.0,0.0,"['infant_care', 'playgroup', 'nursery', 'kindergarten']",1.0,1.0,1.0,1.0,1.0,3
Skool4Kidz Centre (Yishun Oleander Breeze),0.4323135972038074,1.0,0.6166666666666667,,,,0.6166666666666667,,0.0,0.16216216216216217,0.0,1.0,0.0,1.0,1.0,1.0,0.0,0.0,1.0,0.0,1.0,1.0,0.0,0.0,1.0,1.0,1.0,0.0,1.0,1.0,1.0,1.0,1.0,1.0,1.0,1.0,1.0,1.0,1.0,1.0,0.0,1.0,1.0,0.0,1.0,1.0,0.0,0.6986574989870451,3.8043417888765716,15.945390128683556,1.4147226,103.8415387,4.307466119757223,1,7.0,19.0,7.0,19.0,7.0,19.0,7.0,19.0,7.0,19.0,7.0,14.0,100.0,100.0,1,1,1,1,1,1,1,1,1,1,1,1,1,1,1,Preschool,"Blk 512 Yishun St 51, #01-01, Singapore 760512 ","Friday, 7am to 7pm, Saturday, 7am to 2pm, Sunday, Closed, Monday, 7am to 7pm, Tuesday, 7am to 7pm, Wednesday, 7am to 7pm, Thursday, 7am to 7pm",https://www.havence.world/enquiry/skool4kidz/prospect,"https://www.google.com/maps/place/Skool4Kidz+Preschool+@+Yishun+Oleander+Breeze/@1.4147226,103.8415387,17z/data=!3m1!4b1!4m6!3m5!1s0x31da141679a3c4cd:0xda829e159e8f2cbe!8m2!3d1.4147226!4d103.8415387!16s%2Fg%2F11g6vh12sr?entry=ttu",2024-04-12 04:51:01.033075,"5, 5, 5",5.0,Closed,Closed,7am,7pm,7am,7pm,7am,7pm,7am,7pm,7am,7pm,7am,2pm,0.6166666666666667,,,,0.6166666666666667,,https://skool4kidz.com.sg/fees-subsidies/,1234.68,679.63,679.63,679.63,1593.49,900.0,900.0,900.0,1.0,"https___skool4kidz_com_sg_what_teachers_say_2019_, https___skool4kidz_com_sg_skool4kidz_core_values_, https___skool4kidz_com_sg__content, https___skool4kidz_com_sg_our_programme_, https___skool4kidz_com_sg_infants_toddlers_, https___skool4kidz_com_sg_parent_testimonial_2021_, https___skool4kidz_com_sg_healthy_meals_in_skool4kidz_preschool_, https___skool4kidz_com_sg_little_giving_artists_2023_, https___skool4kidz_com_sg_about_us_, https___skool4kidz_com_sg_curriculum_programme_, https___skool4kidz_com_sg_career_, https___skool4kidz_com_sg_privacy_policy_, https___skool4kidz_com_sg_care_fund_, https___skool4kidz_com_sg_parent_testimonial_2022_, https___skool4kidz_com_sg_preschoolers_, https___skool4kidz_com_sg__page_id_17016, https___skool4kidz_com_sg_little_giving_artists_2021_, https___skool4kidz_com_sg_registration_, https___skool4kidz_com_sg_little_giving_artists_2022_, https___skool4kidz_com_sg_, https___skool4kidz_com_sg_happenings_, https___skool4kidz_com_sg_parent_testimonial_2023_, https___skool4kidz_com_sg_what_teachers_say_2022_, https___skool4kidz_com_sg_whats_new_, https___skool4kidz_com_sg_parent_testimonial_2018_, https___skool4kidz_com_sg_contact_us_feedback_, https___skool4kidz_com_sg_what_teachers_say_2020_, https___skool4kidz_com_sg_in_the_news_, https___skool4kidz_com_sg_contact_us_register_your_interest_, https___skool4kidz_com_sg_our_company_history_, https___skool4kidz_com_sg_parent_testimonial_2019_, https___skool4kidz_com_sg_enrichment_, https___skool4kidz_com_sg__, https___skool4kidz_com_sg_fees_subsidies_, https___skool4kidz_com_sg_gallery_, https___skool4kidz_com_sg_parent_testimonial_2020_, https___skool4kidz_com_sg_our_centres_, https___skool4kidz_com_sg_what_teachers_say_2021_","['bilingual_curriculum', 'chinese_curriculum', 'early_years_development_framework', 'english_curriculum', 'integrated_curriculum', 'moe', 'nurturing_early_learners_curriculum', 'reggio_emilia_approach', 'spark_certified_curriculum', 'thematic']",0.0,1.0,0.0,1.0,1.0,1.0,0.0,0.0,1.0,0.0,1.0,1.0,0.0,0.0,1.0,1.0,1.0,0.0,"['aesthetics & creative expression', 'chinese', 'digital skills', 'discovery of the word', 'english', 'language and literacy', 'math', 'moral education', 'motor skill development', 'music', 'nature', 'numeracy', 'project work', 'science', 'social & emotional development', 'speech and drama']",1.0,1.0,1.0,1.0,1.0,1.0,1.0,1.0,1.0,1.0,1.0,1.0,0.0,1.0,1.0,0.0,1.0,1.0,0.0,"['infant_care', 'playgroup', 'nursery', 'kindergarten']",1.0,1.0,1.0,1.0,1.0,3
