Comment,Sentiment,Topic_Number,Word,Preschool_Name
"The preschool my boys attend is fantastic. It boasts a caring, qualified staff, fostering a safe and stimulating environment. With a well-rounded curriculum and modern facilities, it's shaping their early development positively, preparing them for a promising future.",0.2324675324675325,Topic 0,"['teacher', 'child', 'school', 'kid', 'love', 'parent', 'staff', 'thank', 'environment', 'learn', 'care', 'good', 'ms', 'preschool', 'nurture', 'experience', 'activity', 'daughter', 'fun', 'provide']",MindChamps PreSchool @ East Coast
"My son is in the P2 after-school student care, i.e. MindSpace. The staff at Kinex centre are great, patient and helpful. The centre is clean, well-organized with fantastic facility.",0.5222222222222223,Topic 0,"['teacher', 'child', 'school', 'kid', 'love', 'parent', 'staff', 'thank', 'environment', 'learn', 'care', 'good', 'ms', 'preschool', 'nurture', 'experience', 'activity', 'daughter', 'fun', 'provide']",MindChamps PreSchool @ East Coast
"My son has been attending since playgroup and he looks forward to going school to his friends and teachers. Family environment where he gets to interact with kids and teachers of all levels. Very clean place, good for young children just starting school.",0.3191666666666667,Topic 1,"['teacher', 'school', 'child', 'kid', 'care', 'principal', 'good', 'son', 'time', 'parent', 'centre', 'day', 'go', 'thank', 'year', 'love', 'like', 'daughter', 'month', 'take']",MindChamps PreSchool @ East Coast
"Such a clean environment. The teachers are professional, well groomed and equipped with knowledge. My daughter, Nadeen Andrea enjoys going to school as she mentions that her teachers are kind and are always there to assist her when she is in need of guidance.",0.26666666666666666,Topic 0,"['teacher', 'child', 'school', 'kid', 'love', 'parent', 'staff', 'thank', 'environment', 'learn', 'care', 'good', 'ms', 'preschool', 'nurture', 'experience', 'activity', 'daughter', 'fun', 'provide']",MindChamps PreSchool @ East Coast
"MindChamps is a place where kids can have a great chance to grow and learn. All 3 of my kids have been sent to mindchamps. After seeing how my eldest kid had a fruitful journey throughout her kindergarten years. I have now decided to send my two other kids to mindchamps too. The teachers are trained with patience and show great care to the students, leaving us parents with no worries. They also have a great variety of activities to include the children, everyday after school, my children will always tell me how much fun they had at school. I have no regrets in sending them to this school and will be forever grateful for this wonderful learning environment that this school has provided for my children.",0.428125,Topic 0,"['teacher', 'child', 'school', 'kid', 'love', 'parent', 'staff', 'thank', 'environment', 'learn', 'care', 'good', 'ms', 'preschool', 'nurture', 'experience', 'activity', 'daughter', 'fun', 'provide']",MindChamps PreSchool @ East Coast
"Teachers and other staff are just lovely, caring and welcoming to kids. This helps to create a positive environment. Ms Yeo knows all the student by their name, and she greets the parents and students with a smile every morning. This shows how they build relationships with students, even my second daughter, who started school one month ago now she is comfortable with her too. We are glad to choose Mindchamps preschool at East Coast. My two girls, one in PG and another one in N2 now. Teachers (Ms Neesha, Ms Yin and Ms Mae) and the other staff are very affectionate towards the kids ,which makes learning easy and fun. The principal also pays personal attention to every detail and attends to parents need , which is worth appreciation.",0.22389277389277387,Topic 0,"['teacher', 'child', 'school', 'kid', 'love', 'parent', 'staff', 'thank', 'environment', 'learn', 'care', 'good', 'ms', 'preschool', 'nurture', 'experience', 'activity', 'daughter', 'fun', 'provide']",MindChamps PreSchool @ East Coast
"Our 2 kids started attending MC at 18 months. 7 years have passed in the blink of an eye. It has been great having MC partner with us in this journey! MC excels in many areas, such as a holistic approach of balancing academic learning and inculcating a love for learning through fun and varied activities, working with us (including connecting fortnightly despite their busy schedule) to correct bad behaviour in school and at home, and most importantly, the Teachers make all the difference! The Teachers can be both firm and fun-loving (depending on what the occasion calls for). The kids love their Teachers! Bearing testament to this was how the children spontaneously hugged their teacher as she ushered them down the stage at the year-end concert! We have peace of mind when sending the kids to preschool every morning, knowing they are in good hands! Kudos to the MC team! If there is an ask, it would be lovely to restart the “one-night-sleepover” program ( 🙋‍♀️ for me-time!) 😉",0.3222222222222222,Topic 0,"['teacher', 'child', 'school', 'kid', 'love', 'parent', 'staff', 'thank', 'environment', 'learn', 'care', 'good', 'ms', 'preschool', 'nurture', 'experience', 'activity', 'daughter', 'fun', 'provide']",MindChamps PreSchool @ East Coast
Excellent staff who genuinely care for the children! It is rare to find a preschool that is manned by such dedicated teachers. Special shout out to Mrs Koh who made it easy for us to decide which preschool we wanted to send our children to.,0.4317460317460317,Topic 0,"['teacher', 'child', 'school', 'kid', 'love', 'parent', 'staff', 'thank', 'environment', 'learn', 'care', 'good', 'ms', 'preschool', 'nurture', 'experience', 'activity', 'daughter', 'fun', 'provide']",MindChamps PreSchool @ East Coast
A wonderful preschool with caring and loving teachers. Been a parent/patron for the past 4 years. Great system and procedures in place. Would strongly recommend!,0.5383333333333333,Topic 1,"['teacher', 'school', 'child', 'kid', 'care', 'principal', 'good', 'son', 'time', 'parent', 'centre', 'day', 'go', 'thank', 'year', 'love', 'like', 'daughter', 'month', 'take']",MindChamps PreSchool @ East Coast
"Its been at least 5 years with all 3 of my children attending (& attended!) MindChamps @Kinex. Grateful to have them grow and learn in a safe space with a holistic curriculum, a comfortable learning environment and more importantly teachers who genuinely care about their progress and well-being with regular communication and support for parents in my parenting journey. Thank you MIndChamps @kinex!",0.2607142857142857,Topic 0,"['teacher', 'child', 'school', 'kid', 'love', 'parent', 'staff', 'thank', 'environment', 'learn', 'care', 'good', 'ms', 'preschool', 'nurture', 'experience', 'activity', 'daughter', 'fun', 'provide']",MindChamps PreSchool @ East Coast
Dear beloved teachers and classmates， I am regret to say that this Thursday will be Yuwen‘s last day at Minchamps family. On behalf of her，I would like to take this moment to reflect upon the incredible journey she has shared together，4 years at Mindchamps has been nothing short of magical，shaping her earliest memories and setting the foundation for her educational journey. The guidance，patience，and unwavering support have played an instrumental role in her growth. Your creative teaching methods，warm smiles and encouragement will be etched in her heart. You’ve not only taught her lessons from books but also lessons about kindness，respect and the journey of expiration. To her dear classmates，each of you has been a source of joy and inspiration. From shared laughter and adventures，you‘ve made her everyday at school unforgettable. The bonds you have formed are special，and I am grateful for the friendship that have taken root during your time together. I want to express my heartfelt gratitude to all of you. The memories created will always be cherished，and the lessons learned will continue to guide her. Thank you for being an exceptional mentor，and thank you her wonderful classmates，for being the best companions anyone could ask for. With sincere gratitude and fondest memories.,0.46111111111111114,Topic 0,"['teacher', 'child', 'school', 'kid', 'love', 'parent', 'staff', 'thank', 'environment', 'learn', 'care', 'good', 'ms', 'preschool', 'nurture', 'experience', 'activity', 'daughter', 'fun', 'provide']",MindChamps PreSchool @ East Coast
"Our child is currently with the Mindchamps for 9 months already. So far, we have been very happy with our preschool decision. We only have one child, and she is very active. As such, we are often anxious and always skeptical, if any school can guide her well. The Teachers have been very kind and supportive. We can always see improvements in her languages, behavior and social attitudes. She often gives us surprises, for example, keeps her own toys, asked for permissions to do certain things, know how to be kind or apologize when something goes wrong, speak proper sentences, able to share her toys and food etc On top of that, the school activities also help her to further develop the mind, writing her very first alphabet and initiate to sit at one corner to flip the books and using her little fingers to go through all the sentences. We did not imagine our active child who just turned 3-year-old, is capable to do all these by herself. We look forward for more of her good character being build up in this school. We would like to thank all the teachers for your patience, effort and also your unconditional love and care for her.",0.20417124542124548,Topic 1,"['teacher', 'school', 'child', 'kid', 'care', 'principal', 'good', 'son', 'time', 'parent', 'centre', 'day', 'go', 'thank', 'year', 'love', 'like', 'daughter', 'month', 'take']",MindChamps PreSchool @ East Coast
"We’ve been with MindChamps Kinex for 5.5 years. The principal and teachers have been very helpful and sensitive to my children’s needs, and have gone beyond their duties to groom and nurture them. The principal and teachers also guided my husband and I on methods we could use at home to encourage positive behaviors. My eldest have matured emotionally over the years, and this wouldn’t have been so without the help and support from the team at MC Kinex! Thank you! ❤️",0.13181818181818183,Topic 0,"['teacher', 'child', 'school', 'kid', 'love', 'parent', 'staff', 'thank', 'environment', 'learn', 'care', 'good', 'ms', 'preschool', 'nurture', 'experience', 'activity', 'daughter', 'fun', 'provide']",MindChamps PreSchool @ East Coast
"My daughter has been attending mindchamps for 4 years since PG and I’d like to thank all staff, teachers and the principal for everything. My daughter has become more independent and also developed a keen interest in reading and writing. I couldn’t be more pleased with all the recent developments.",0.26666666666666666,Topic 0,"['teacher', 'child', 'school', 'kid', 'love', 'parent', 'staff', 'thank', 'environment', 'learn', 'care', 'good', 'ms', 'preschool', 'nurture', 'experience', 'activity', 'daughter', 'fun', 'provide']",MindChamps PreSchool @ East Coast
"Highly recommend Mindchamps Kinex. Mrs Koh, Ms Christina and their team of teachers are very professional and committed to delivering the best for the kids. The school provides regular updates on my kids, both academically and on any behaviours / habits, which is something that I really appreciate. My K2 son's reading and writing abilities has improved tremendously within a short period of time and I would like to thank Ms Camille for that. He has also taken an interest in Legos which I believe is due to the exposure he has in school. My PG daughter was able to settle down in school quickly with the help of Ms Neesha and Xu Laoshi, who have their ways to handle the little ones. On top of that, the school has many activities arranged for the children, and my kids look forward to go school everyday. You should definitely consider Mindchamps Kinex if you are looking for a quality preschool.",0.18678819444444444,Topic 0,"['teacher', 'child', 'school', 'kid', 'love', 'parent', 'staff', 'thank', 'environment', 'learn', 'care', 'good', 'ms', 'preschool', 'nurture', 'experience', 'activity', 'daughter', 'fun', 'provide']",MindChamps PreSchool @ East Coast
"I would definitely recommend MindChamps Kinex to families and friends with kids. The principal and team are very professional and hands on with the kids. My little one started school with them when she turned 18months. Ms Christina, Ms Neesha and Xu lao Shi did a fabulous job in easing the little one into school. My wife and I get daily updates on the progression and photos of the little one via the school’s app. The working relationship between parents and Teachers aren’t limited to school issues, the team of Teachers also check in with parents on the child’s behaviour and habits at home. This enables the team of teachers to better understand the little one. The Teachers also share with parents what is taught and enforced in school such that parents can try doing so at home. Mindchamp Kinex has many activities and hands on learning opportunities for the kids. We are happy to see the development and improvement of our little one given that she only started school for 3 months. Thank you very much to the principal and Teachers for guiding and teaching our little one. We were fortunate to have enrolled her into mindchamp Kinex.",0.09964285714285714,Topic 0,"['teacher', 'child', 'school', 'kid', 'love', 'parent', 'staff', 'thank', 'environment', 'learn', 'care', 'good', 'ms', 'preschool', 'nurture', 'experience', 'activity', 'daughter', 'fun', 'provide']",MindChamps PreSchool @ East Coast
MC Kinex has done a fabulous job in equipping my children with the foundation and lifelong skills they need to embark on their educational journey. It has been very satisfying to experience having to coax my children to go to school to them eagerly awaiting the start of the new school week. Watching how my eldest was able to transition seamlessly from kindergarten to primary school proves that the decision to send my children to mc kinex was the right one and is a testament to the dedication and professionalism of all the staff there.,0.2922077922077922,Topic 0,"['teacher', 'child', 'school', 'kid', 'love', 'parent', 'staff', 'thank', 'environment', 'learn', 'care', 'good', 'ms', 'preschool', 'nurture', 'experience', 'activity', 'daughter', 'fun', 'provide']",MindChamps PreSchool @ East Coast
"As a new mother, I was apprehensive about sending my son to school. At 18 months, he’s a bit rowdy and not less than what I would consider obedient. Wasn’t sure how the schools, especially the teachers would be able to handle him. Coming close to 6 months now, I am very happy with the experience in MindCamps @ OneKM. The teachers there are very good with kids and have consistent technique to manage various situations. Management is also responsive and patient to adddress our concerns. Overall, happy to see my son learning and enjoying himself in school.",0.3907459207459207,Topic 1,"['teacher', 'school', 'child', 'kid', 'care', 'principal', 'good', 'son', 'time', 'parent', 'centre', 'day', 'go', 'thank', 'year', 'love', 'like', 'daughter', 'month', 'take']",MindChamps PreSchool @ East Coast
"I highly recommend MC at Kinex, where my two sons have been attending for about a year. Having had bad experience at two other private preschools before this, my family and I are relieved to finally find a preschool that my boys enjoy attending while we are at work. Under the strong leadership of Mrs Koh, the team of teachers work together with great synergy and a common vision. As such, the “attrition rate” among teachers seems to be pretty low compared to other schools we have been to. The teachers are passionate, patient, caring, yet firm. We are grateful to all the teachers who spent much effort keeping the children safe (during covid19) and helped the boys to progress in their development. Special mention to Ms Hidayah and Hui Laoshi who went over and above their duties in guiding my boys. Thank you!",0.07502380952380953,Topic 0,"['teacher', 'child', 'school', 'kid', 'love', 'parent', 'staff', 'thank', 'environment', 'learn', 'care', 'good', 'ms', 'preschool', 'nurture', 'experience', 'activity', 'daughter', 'fun', 'provide']",MindChamps PreSchool @ East Coast
"We are so lucky to have found MindChamps@one km. Dedicated teachers who not only take care of my girls and correct bad behaviors, but also genuinely have fun with them in the process. I like that the teachers are transparent and always welcome parents into school. My kids are comfortable with any of the teachers, not just with their own class teachers. Turnover ratio of the teachers is also low. Plenty of events and excursions in one year with a sleepover during children‘s day. I’m not endorsing the MindChamps brand, just endorsing the team behind this particular preschool.",0.17272727272727278,Topic 0,"['teacher', 'child', 'school', 'kid', 'love', 'parent', 'staff', 'thank', 'environment', 'learn', 'care', 'good', 'ms', 'preschool', 'nurture', 'experience', 'activity', 'daughter', 'fun', 'provide']",MindChamps PreSchool @ East Coast
"We were strongly recommended by our good friend to send our 2 year old toddler to Mindchamps PreSchool @ KINEX (East Coast). Our friend has 3 kids herself and they all attended Mindchamps PreSchool @ KINEX (East Coast) too. She told us that Mindchamps PreSchool @ KINEX (East Coast)stood out from all other preschools due to the dedicated teachers who have been with the centre and school principal for many years. Indeed the PG Teachers have been very caring, patient and attentive towards my son and his classmates. Personally, it was not a easy decision to send our very young son to a preschool in the first place. After all, he will be spending many hours in the preschool and it will definitely have an impact on his behaviour and development. Luckily, a high quality preschool like Mindchamps PreSchool @ KINEX (East Coast) have brought about positive outcome for my son. My son is a well-adjusted child who enjoys going to school and likes spending time with his Teachers and friends. Thank you Mindchamps Teachers for looking out for my son KJ! Really appreciate it!",0.20239750445632798,Topic 0,"['teacher', 'child', 'school', 'kid', 'love', 'parent', 'staff', 'thank', 'environment', 'learn', 'care', 'good', 'ms', 'preschool', 'nurture', 'experience', 'activity', 'daughter', 'fun', 'provide']",MindChamps PreSchool @ East Coast
"I sent my daughter to MindChamps Kinex when she was just starting K1. Prior to MindChamps Kinex, my daughter was attending another childcare centre for her N1 & N2 years. The teachers were very patient and understanding. They helped my daughter to transit into a different environment with ease. She used to dislike going to school but ever since attending MindChamps Kinex, she looks forward to her lessons every day. On top of that, there were huge improvements in her academically. She can read and write very well. Her Mandarin improved tremendously too. Lastly, the teachers are very prompt in their communication and the centre, helmed by Mrs Koh, is very orderly and well organised. I am most impressed with the well thought out curriculum and its efficient delivery method during the Circuit Breaker period. All in all, I highly recommend MindChamps Kinex to all parents!",0.26666666666666666,Topic 0,"['teacher', 'child', 'school', 'kid', 'love', 'parent', 'staff', 'thank', 'environment', 'learn', 'care', 'good', 'ms', 'preschool', 'nurture', 'experience', 'activity', 'daughter', 'fun', 'provide']",MindChamps PreSchool @ East Coast
My child has been in this school since PG. All the staff and teachers have been great. We always felt comforted knowing our child is in good hands. Teachers are caring and communicate to us regularly regarding our child's progress. A big thank you to everyone at Mindchamps Preschool@East Coast.,0.375,Topic 0,"['teacher', 'child', 'school', 'kid', 'love', 'parent', 'staff', 'thank', 'environment', 'learn', 'care', 'good', 'ms', 'preschool', 'nurture', 'experience', 'activity', 'daughter', 'fun', 'provide']",MindChamps PreSchool @ East Coast
"Great teachers at MindChamps PreSchool @KINEX- professional and pleasant. My child has been with them since PG, and with continued encouragement from Mrs Koh, his principal, I have seen positive emotional growth in him over the years. Not only has he blossomed in terms of his confidence, the way he interacts with his friends, also being able to express himself. Highly recommended school!",0.32007575757575757,Topic 0,"['teacher', 'child', 'school', 'kid', 'love', 'parent', 'staff', 'thank', 'environment', 'learn', 'care', 'good', 'ms', 'preschool', 'nurture', 'experience', 'activity', 'daughter', 'fun', 'provide']",MindChamps PreSchool @ East Coast
"First class teachers and management team. Lauren progression went beyond our expectations within a short span of 2 years. She absolutely loves school now. Also communication is great as the parents are always updated. Besides in house learning, lots of outdoor activities to keep the kids constantly engaged. A peace of mind when your kids are with MindChamps. Thanks you!",0.25,Topic 0,"['teacher', 'child', 'school', 'kid', 'love', 'parent', 'staff', 'thank', 'environment', 'learn', 'care', 'good', 'ms', 'preschool', 'nurture', 'experience', 'activity', 'daughter', 'fun', 'provide']",MindChamps PreSchool @ East Coast
"Our 2 kids have been with MindChamps East Coast since they were 18 months old. As with most other kids, the first few months were very stressful as the kids were wailing and crying when we send them to school. The teachers and principal handled the situation well and we were informed constantly of our kids’ progress and also discussion were held to evaluate how we can best overcome the kids’ reluctance to go to school. We appreciate the attention that has been given to our kids and applaud the dedication that team of teachers has demonstrated that is led by Mrs Koh.",0.16944444444444443,Topic 1,"['teacher', 'school', 'child', 'kid', 'care', 'principal', 'good', 'son', 'time', 'parent', 'centre', 'day', 'go', 'thank', 'year', 'love', 'like', 'daughter', 'month', 'take']",MindChamps PreSchool @ East Coast
"Think no more if you are considering MindChamps East Coast to enroll your child. Both my children are attending this preschool and I have absolutely nothing to complain about. Teachers are attentive and prompt to update, low turnover rate and care for the children with big hearts. I go to work with peace of mind knowing my children are well taken care of by this stellar team.",0.10000000000000002,Topic 1,"['teacher', 'school', 'child', 'kid', 'care', 'principal', 'good', 'son', 'time', 'parent', 'centre', 'day', 'go', 'thank', 'year', 'love', 'like', 'daughter', 'month', 'take']",MindChamps PreSchool @ East Coast
"I love this PreSchool. Teachers are experienced, friendly, committed and very innovative! The outdoor playground is great and even better when it gets converted to water play at times! My son is outspoken and academically well. The teachers have taught him well. He learns responsibilities, manners and patience. Most of all, he is happy and loves attending school!",0.6765625,Topic 0,"['teacher', 'child', 'school', 'kid', 'love', 'parent', 'staff', 'thank', 'environment', 'learn', 'care', 'good', 'ms', 'preschool', 'nurture', 'experience', 'activity', 'daughter', 'fun', 'provide']",MindChamps PreSchool @ East Coast
"Wonderful preschool! My first child has spent 3 year here since we moved to Singapore. He is still missing the preschool and teachers although he is in primary school now. Teachers are experienced and patient. They not only took good care of my child, but also got him well prepared for his next journey in primary school. We will send our second baby to this school soon. I would like to say THANK YOU to the principle and teachers for their great efforts and excellent job!",0.3884615384615385,Topic 0,"['teacher', 'child', 'school', 'kid', 'love', 'parent', 'staff', 'thank', 'environment', 'learn', 'care', 'good', 'ms', 'preschool', 'nurture', 'experience', 'activity', 'daughter', 'fun', 'provide']",MindChamps PreSchool @ East Coast
I would highly recommend Mindchamps Kinex to any potential parents looking for a holistic preschool for your child. The outdoor play area is great for the kids to get some sun and run around. The teachers are kind and caring. The principal helms the centre efficiently and is friendly yet professional with parents. What I especially like is that Mrs Koh emphasises on the importance of discipline and having good moral values and not just on academics. The teachers did a great job during the circuit breaker and went above and beyond their call of duty to ensure the charges under their care were still learning from home and having fun. The mgmt has taken many steps to ensure the children are safe and happy in school given the current constraints. Kudos to the team at Kinex!,0.3521875,Topic 0,"['teacher', 'child', 'school', 'kid', 'love', 'parent', 'staff', 'thank', 'environment', 'learn', 'care', 'good', 'ms', 'preschool', 'nurture', 'experience', 'activity', 'daughter', 'fun', 'provide']",MindChamps PreSchool @ East Coast
