Comment,Sentiment,Topic_Number,Word,Preschool_Name
I had the opportunity to visit Mindchamp Punggol past week . Ms Veron the senior principal of the centre was kind enough to show me around. I was enthralled by exburence of centre ..the creativity and imagination of the centre children guided by the dedicated teachers was awesome n .refreshing..Kudos to Ms Veron and the teachers,0.3375,Topic 0,"['teacher', 'child', 'school', 'kid', 'love', 'parent', 'staff', 'thank', 'environment', 'learn', 'care', 'good', 'ms', 'preschool', 'nurture', 'experience', 'activity', 'daughter', 'fun', 'provide']",MindChamps PreSchool @ Punggol
Teachers are passionate and patient to students. Very happy with sending our child to this school. Thanks Teachers!!,0.42083333333333334,Topic 1,"['teacher', 'school', 'child', 'kid', 'care', 'principal', 'good', 'son', 'time', 'parent', 'centre', 'day', 'go', 'thank', 'year', 'love', 'like', 'daughter', 'month', 'take']",MindChamps PreSchool @ Punggol
"Thank you to every teacher at Mindchamps Punggol Northshore, it's really great! Great centre with friendly and professional staff. The centre is well presented and very clean, the areas for the children have great toys and amazing large outdoor yard.",0.5457440476190477,Topic 0,"['teacher', 'child', 'school', 'kid', 'love', 'parent', 'staff', 'thank', 'environment', 'learn', 'care', 'good', 'ms', 'preschool', 'nurture', 'experience', 'activity', 'daughter', 'fun', 'provide']",MindChamps PreSchool @ Punggol
Massive campus with big classrooms to facilitate learning. Huge outdoor playground and surrounded by the shoreline and greenery that makes learning a lot more engaging.,0.26000000000000006,Topic 0,"['teacher', 'child', 'school', 'kid', 'love', 'parent', 'staff', 'thank', 'environment', 'learn', 'care', 'good', 'ms', 'preschool', 'nurture', 'experience', 'activity', 'daughter', 'fun', 'provide']",MindChamps PreSchool @ Punggol
Highly rated center where teachers go over and beyond and kids benefit from the nurturing culture. The champs grow up to be confident and vocal with a never-give-up mindset.,0.18666666666666668,Topic 0,"['teacher', 'child', 'school', 'kid', 'love', 'parent', 'staff', 'thank', 'environment', 'learn', 'care', 'good', 'ms', 'preschool', 'nurture', 'experience', 'activity', 'daughter', 'fun', 'provide']",MindChamps PreSchool @ Punggol
"A Great workshop that allowed me to learn more creative ways to teach my child, and for my child to build more interest in storytelling. A different way of learning through storytelling as well.",0.45999999999999996,Topic 0,"['teacher', 'child', 'school', 'kid', 'love', 'parent', 'staff', 'thank', 'environment', 'learn', 'care', 'good', 'ms', 'preschool', 'nurture', 'experience', 'activity', 'daughter', 'fun', 'provide']",MindChamps PreSchool @ Punggol
A frustrating ordeal for me to simply have my deposit balance refunded after my son’s withdrawal on 31 Dec 2022. Admin keeps on saying will call us back but no one called and no update. Had to call HQ and again told me to wait for another 7 days. I’ve had my share of ups and downs with this preschool.,-0.13333333333333333,Topic 1,"['teacher', 'school', 'child', 'kid', 'care', 'principal', 'good', 'son', 'time', 'parent', 'centre', 'day', 'go', 'thank', 'year', 'love', 'like', 'daughter', 'month', 'take']",MindChamps PreSchool @ Punggol
"Best choice of preschools in Punggol - enrolled my boy into it since his PG and the school has been nurturing him with good care and their best-in-class curriculums. A fun, fruitful and enjoyable learning experience for preschoolers.""",0.625,Topic 0,"['teacher', 'child', 'school', 'kid', 'love', 'parent', 'staff', 'thank', 'environment', 'learn', 'care', 'good', 'ms', 'preschool', 'nurture', 'experience', 'activity', 'daughter', 'fun', 'provide']",MindChamps PreSchool @ Punggol
"""When we first transferred our daughter into Mind Champs at Raffles Town Club, we were not sure if she will be able to adapt to a new environment. With the constant care and concern shown by all her teachers, Alyssa was soon looking forward to attending school everyday. Additionally, we have seen how she was learning to be more expressive and able to articulate much better than before. Mind Champs curriculum has definitely provided a platform for her to grow into a confident young lady. Thank you Team RTC!",0.25856643356643355,Topic 0,"['teacher', 'child', 'school', 'kid', 'love', 'parent', 'staff', 'thank', 'environment', 'learn', 'care', 'good', 'ms', 'preschool', 'nurture', 'experience', 'activity', 'daughter', 'fun', 'provide']",MindChamps PreSchool @ Raffles Town Club
"My daughter graduated from MindChamps@RTC last year and is now with MindSpace@RTC after-school care. Putting her there gives us great assurance that her needs are well taken care of daily, as the teachers are caring, loving and helpful.",0.35,Topic 1,"['teacher', 'school', 'child', 'kid', 'care', 'principal', 'good', 'son', 'time', 'parent', 'centre', 'day', 'go', 'thank', 'year', 'love', 'like', 'daughter', 'month', 'take']",MindChamps PreSchool @ Raffles Town Club
"The teachers are very friendly, warm and approachable. Both my children enjoy school and return home very happy everyday.",0.4574999999999999,Topic 1,"['teacher', 'school', 'child', 'kid', 'care', 'principal', 'good', 'son', 'time', 'parent', 'centre', 'day', 'go', 'thank', 'year', 'love', 'like', 'daughter', 'month', 'take']",MindChamps PreSchool @ Raffles Town Club
"MindChamps PreSchool @ Raffles Town Club is a truly wonderful place! During my son’s two fruitful years here, we have witnessed tremendous growth in both his education and social development. He comes home full of stories about what they are doing, special themed weeks, or field trip. It is a global community and does a great job of celebrating variety of cultures and their important days. Parents are always welcome and are encouraged to volunteer in their children’s learning journey. The Principal and Teachers at MindChamps PreSchool @ Raffles Town Club are professional as well as personal. They are easily approachable and are ready and willing to assist families with their needs and concerns. Attending at MindChamps PreSchool @ Raffles Town Club has given our family so much. We have really enjoyed being part of the MindChamps family and highly recommend it to anyone looking for great school.",0.3731746031746032,Topic 0,"['teacher', 'child', 'school', 'kid', 'love', 'parent', 'staff', 'thank', 'environment', 'learn', 'care', 'good', 'ms', 'preschool', 'nurture', 'experience', 'activity', 'daughter', 'fun', 'provide']",MindChamps PreSchool @ Raffles Town Club
"My children have been attending MindChamps Preschool @ Raffles Town Club since 2019. It is a great joy sending and picking them up from school as both children are always excited about school. They leave school with excitement in their eyes and always raring to share about their day in school. Both of them thoroughly enjoy school and always share their positive experiences in school which allow them to develop their social competencies and also cognitively and physically. The school organizes regular outings related to the theme that the children are exploring and celebrations in school to commemorate Singapore’s culture and heritage. They also organize book reads with local authors which heighten their interest to read. As parents, we are heartened to see our children being nurtured with positive dispositions towards learning. The teachers and staff are caring and make the effort to build a strong teacher-parent relationship to ensure our children’s well-being at school. Despite their busy schedules, they will find time to inform me of my children’s progress and discuss issues related to the problems and challenges faced by my children in school. I am very grateful to them for the time and care they have given to our children. I would like to express my heartfelt appreciation to all the teachers who have shared their wisdom and knowledge in establishing the foundation of my children’s education. Kudos to the administrative and operation staff to make the physical environment safe and conducive for learning and definitely Miss Jacelyn and Miss June for constantly being around which is a reassurance to both students and parents. Thank you everyone for your passion and dedication to nurturing our littles one at MindChamps Preschool @ Raffles Town Club.",0.20481060606060603,Topic 0,"['teacher', 'child', 'school', 'kid', 'love', 'parent', 'staff', 'thank', 'environment', 'learn', 'care', 'good', 'ms', 'preschool', 'nurture', 'experience', 'activity', 'daughter', 'fun', 'provide']",MindChamps PreSchool @ Raffles Town Club
"I am happy that we made the right decision to enroll our first born at MindChamps. The facilities are excellent and well-maintained, the students can access the kids' pool and tennis court, teachers are competent and passionate, the management gives us regular update on our son's progress. Every dollar we spend for his preschool education is paid off every time we hear his jolly stories about school. Thank you, MindChamps!",0.39795918367346944,Topic 1,"['teacher', 'school', 'child', 'kid', 'care', 'principal', 'good', 'son', 'time', 'parent', 'centre', 'day', 'go', 'thank', 'year', 'love', 'like', 'daughter', 'month', 'take']",MindChamps PreSchool @ Raffles Town Club
"Fantastic experience with RTC. Great teachers and management team, nice school facilities. Highly recommend 👍 ",0.49000000000000005,Topic 0,"['teacher', 'child', 'school', 'kid', 'love', 'parent', 'staff', 'thank', 'environment', 'learn', 'care', 'good', 'ms', 'preschool', 'nurture', 'experience', 'activity', 'daughter', 'fun', 'provide']",MindChamps PreSchool @ Raffles Town Club
"Great place for my girl to learn and play, never a single day she refuse to go to school. ♥️♥️♥️",0.41785714285714287,Topic 1,"['teacher', 'school', 'child', 'kid', 'care', 'principal', 'good', 'son', 'time', 'parent', 'centre', 'day', 'go', 'thank', 'year', 'love', 'like', 'daughter', 'month', 'take']",MindChamps PreSchool @ Raffles Town Club
A wonderful school! My daughter actually looks forward going to school now!!,0.5,Topic 1,"['teacher', 'school', 'child', 'kid', 'care', 'principal', 'good', 'son', 'time', 'parent', 'centre', 'day', 'go', 'thank', 'year', 'love', 'like', 'daughter', 'month', 'take']",MindChamps PreSchool @ Raffles Town Club
Thank you to the management and teachers. My kid had a wonderful time.,1.0,Topic 0,"['teacher', 'child', 'school', 'kid', 'love', 'parent', 'staff', 'thank', 'environment', 'learn', 'care', 'good', 'ms', 'preschool', 'nurture', 'experience', 'activity', 'daughter', 'fun', 'provide']",MindChamps PreSchool @ Raffles Town Club
It’s a lovely learning joinery with MindChamps,0.5,Topic 0,"['teacher', 'child', 'school', 'kid', 'love', 'parent', 'staff', 'thank', 'environment', 'learn', 'care', 'good', 'ms', 'preschool', 'nurture', 'experience', 'activity', 'daughter', 'fun', 'provide']",MindChamps PreSchool @ Raffles Town Club
"Well organised!""",0.0,Topic 1,"['teacher', 'school', 'child', 'kid', 'care', 'principal', 'good', 'son', 'time', 'parent', 'centre', 'day', 'go', 'thank', 'year', 'love', 'like', 'daughter', 'month', 'take']",MindChamps PreSchool @ Raffles Town Club
"""My daughter loves her teachers and her friends. She enjoys going to school everyday and I see her growing up with confidence and kindness ❤️ Now that she graduated, I believe with all the support she was given at the school, she is well-prepared for the coming journey. Big thank to the school 🤩 ",-0.1,Topic 1,"['teacher', 'school', 'child', 'kid', 'care', 'principal', 'good', 'son', 'time', 'parent', 'centre', 'day', 'go', 'thank', 'year', 'love', 'like', 'daughter', 'month', 'take']",MindChamps PreSchool @ Toa Payoh
The K2 graduation concert is awesome! Very well planned and great concept about go green! Thank you once again! Responsible teachers. Always having a smiley face. Thank you MindChamps teachers for always giving us the best :),0.48392857142857143,Topic 1,"['teacher', 'school', 'child', 'kid', 'care', 'principal', 'good', 'son', 'time', 'parent', 'centre', 'day', 'go', 'thank', 'year', 'love', 'like', 'daughter', 'month', 'take']",MindChamps PreSchool @ Toa Payoh
"My Three loving Princess was in the TPY branch. The teachers are wonderful and Caring. Since the day they transfer from other school to MindChamps TPY , I could see their improvement on growing up skills. Languages, good self behaviour attitude and more . Appreciated and grateful thanks the the teachers and teams members on patiently taught on my 3 loving Champs.",0.45937500000000003,Topic 0,"['teacher', 'child', 'school', 'kid', 'love', 'parent', 'staff', 'thank', 'environment', 'learn', 'care', 'good', 'ms', 'preschool', 'nurture', 'experience', 'activity', 'daughter', 'fun', 'provide']",MindChamps PreSchool @ Toa Payoh
"I'm so grateful to found a preschool that my son love it. The services provided by teachers and staff are awesome.. they're so polite,caring,thoughtful towards the kids. I like the concepts of Mindchamp preschool to let kids to explore to new things..",0.5454545454545454,Topic 0,"['teacher', 'child', 'school', 'kid', 'love', 'parent', 'staff', 'thank', 'environment', 'learn', 'care', 'good', 'ms', 'preschool', 'nurture', 'experience', 'activity', 'daughter', 'fun', 'provide']",MindChamps PreSchool @ Toa Payoh
"Our daughter has a great time (over 4 years) at MindChamps TPY. She enjoys the every moment at school. Even during the difficult times of Covid, the school staffs and teachers were doing a great job to ensure all champs’ safety and happiness of studying at school. When coming to graduation, the K2 teachers arranged wonderful day-camp and programs for champs to have a great time. Highly recommended and Thumbs Up 👍 !",0.5428571428571428,Topic 0,"['teacher', 'child', 'school', 'kid', 'love', 'parent', 'staff', 'thank', 'environment', 'learn', 'care', 'good', 'ms', 'preschool', 'nurture', 'experience', 'activity', 'daughter', 'fun', 'provide']",MindChamps PreSchool @ Toa Payoh
"Nurturing and outstanding teachers, exceptional and sound curriculum. Capable management and administration. Always trusted them to take great care of my 3 kids, and provide them with an amazing education and environment!",0.5527777777777777,Topic 0,"['teacher', 'child', 'school', 'kid', 'love', 'parent', 'staff', 'thank', 'environment', 'learn', 'care', 'good', 'ms', 'preschool', 'nurture', 'experience', 'activity', 'daughter', 'fun', 'provide']",MindChamps PreSchool @ Toa Payoh
My 2 children grew up with mindchamp preschool. I like how the school is wholistic in training up the children. Teachers are exceptionally professional and passionate. The school provides a clean and positive environment for the child to grow. Highly recommended.,0.16078787878787879,Topic 0,"['teacher', 'child', 'school', 'kid', 'love', 'parent', 'staff', 'thank', 'environment', 'learn', 'care', 'good', 'ms', 'preschool', 'nurture', 'experience', 'activity', 'daughter', 'fun', 'provide']",MindChamps PreSchool @ Toa Payoh
"My kids study here and I think besides the curriculum at this school, what really stood out was the immense effort they had put in for the Graduation ceremony. I can't imagine the efforts the teachers and champs been through for this. Kudos to the team at Mindchamps Toa Payoh for making it happen!",0.1,Topic 1,"['teacher', 'school', 'child', 'kid', 'care', 'principal', 'good', 'son', 'time', 'parent', 'centre', 'day', 'go', 'thank', 'year', 'love', 'like', 'daughter', 'month', 'take']",MindChamps PreSchool @ Toa Payoh
Fantastic event! All kids and parents have enjoyed so much! Really appreciate the effort from all the teachers and school stuff. good job!,0.51875,Topic 0,"['teacher', 'child', 'school', 'kid', 'love', 'parent', 'staff', 'thank', 'environment', 'learn', 'care', 'good', 'ms', 'preschool', 'nurture', 'experience', 'activity', 'daughter', 'fun', 'provide']",MindChamps PreSchool @ Toa Payoh
"Attended my girl K2 graduation and I have to see it was the best ever! Many many tear jerkers moments and I actually cried so many times. I can feel the hard work put in by the teachers. It is definitely not easy! More importantly, my child enjoyed every single moment! It was indeed a proud moment for everyone! Well done mindchamps!",0.3540178571428571,Topic 1,"['teacher', 'school', 'child', 'kid', 'care', 'principal', 'good', 'son', 'time', 'parent', 'centre', 'day', 'go', 'thank', 'year', 'love', 'like', 'daughter', 'month', 'take']",MindChamps PreSchool @ Toa Payoh
"I had a negative experience with MindChamps. I registered, paid a deposit, and two months' fees to secure a promotional rate during registration. I completed all required forms and waited for my daughter's class to begin in less than two months. However, about two to three weeks after registration, I received a call informing me of a fee increase. The staff told me that if I do not agree with the increment, I can choose to withdraw and they will refund fully. But this was not what I was initially told during sign-up. I'm aware that I'm not the only parent affected by this. MindChamps did not honor their promise, and the principal unashamedly mentioned a clause that is ‘allowing them to change terms and conditions without notice’, which left me stunned. Their sales tactic was to lock in a special 12-month fee promotion during the special registration period. I find MindChamps Singapore's actions disappointing and unacceptable. But anyway, thanks to their management, this turned out to be a blessing in disguise for us. I'm extremely relieved that my child is not part of this school. I personally know a few music teachers working at MC. While I understand that personal lives should generally not be intertwined with one's profession as a teacher working there, I can't help but feel a great sense of relief that my child is not being taught or cared for by certain music teachers.",0.034837092731829576,Topic 1,"['teacher', 'school', 'child', 'kid', 'care', 'principal', 'good', 'son', 'time', 'parent', 'centre', 'day', 'go', 'thank', 'year', 'love', 'like', 'daughter', 'month', 'take']",MindChamps PreSchool @ Toa Payoh
"Both of my kids went/go to MindChamps Toa Payoh. They enjoyed very much their learning journey and life at the childcare. The teachers are all very friendly and amiable. You can feel their love of the kids from the moment the kids arriving at the school gate in the morning. We also value the enriched curriculum and activities arranged by the school which prepare the kids for primary school life academically and non academically. If there were one thing I could wish the school do better, it would be no incremental fee every year as it has been expensive already.",0.3067857142857143,Topic 0,"['teacher', 'child', 'school', 'kid', 'love', 'parent', 'staff', 'thank', 'environment', 'learn', 'care', 'good', 'ms', 'preschool', 'nurture', 'experience', 'activity', 'daughter', 'fun', 'provide']",MindChamps PreSchool @ Toa Payoh
The school’s nurturing environment and dedicated teachers have sparked a love of learning in our child. Truly a remarkable place for little ones to grow and thrive.,0.3541666666666667,Topic 0,"['teacher', 'child', 'school', 'kid', 'love', 'parent', 'staff', 'thank', 'environment', 'learn', 'care', 'good', 'ms', 'preschool', 'nurture', 'experience', 'activity', 'daughter', 'fun', 'provide']",MindChamps PreSchool @ Toa Payoh
"My child is currently in N1 and the Teachers constantly feedback what are the areas my child has done well and the areas that need more attention. They regularly update the app with photos of my child having fun in school and promptly replies msgs. Communication between Teachers, parents and children are good!",0.2791666666666667,Topic 1,"['teacher', 'school', 'child', 'kid', 'care', 'principal', 'good', 'son', 'time', 'parent', 'centre', 'day', 'go', 'thank', 'year', 'love', 'like', 'daughter', 'month', 'take']",MindChamps PreSchool @ Toa Payoh
Thank you Mindchamps for all the effort & time to put the graduation together. The child has been looking forward given all the preparation and guidance from the dedicated and nurturing teachers!,0.0,Topic 0,"['teacher', 'child', 'school', 'kid', 'love', 'parent', 'staff', 'thank', 'environment', 'learn', 'care', 'good', 'ms', 'preschool', 'nurture', 'experience', 'activity', 'daughter', 'fun', 'provide']",MindChamps PreSchool @ Toa Payoh
"Today is a great experienced as teachers invited parents to do activities with kids. This is really a great idea. Overall, this school is perfect with regards to hygiene, staff and curriculum. All the best Mindchamp TPY",0.7333333333333334,Topic 0,"['teacher', 'child', 'school', 'kid', 'love', 'parent', 'staff', 'thank', 'environment', 'learn', 'care', 'good', 'ms', 'preschool', 'nurture', 'experience', 'activity', 'daughter', 'fun', 'provide']",MindChamps PreSchool @ Toa Payoh
Best premium education for the young ones. TPY is managed under Mindchamps HQ and is a brand new facility. Our daughter loves it there,0.4121212121212121,Topic 1,"['teacher', 'school', 'child', 'kid', 'care', 'principal', 'good', 'son', 'time', 'parent', 'centre', 'day', 'go', 'thank', 'year', 'love', 'like', 'daughter', 'month', 'take']",MindChamps PreSchool @ Toa Payoh
"Excellent parent child bonding time with different activities to keep adults and child entertained. Teachers were very engaging thus making the 2023 June Family Day a great success. Good job and great work, teachers and support staff!",0.6171428571428572,Topic 0,"['teacher', 'child', 'school', 'kid', 'love', 'parent', 'staff', 'thank', 'environment', 'learn', 'care', 'good', 'ms', 'preschool', 'nurture', 'experience', 'activity', 'daughter', 'fun', 'provide']",MindChamps PreSchool @ Toa Payoh
Mindchamps has been a great place for holistic learning for both my children. I have seen them understand the concepts and try different things. It’s a great place for growth of young minds. Their curriculum is always designed by experts in different fields and that goes a long way in making a difference on how the kids see and perceive things.,0.275,Topic 0,"['teacher', 'child', 'school', 'kid', 'love', 'parent', 'staff', 'thank', 'environment', 'learn', 'care', 'good', 'ms', 'preschool', 'nurture', 'experience', 'activity', 'daughter', 'fun', 'provide']",MindChamps PreSchool @ Toa Payoh
This year she is in k2 level which mean e starting of spelling and she actually enjoyed n look forward to.She can tell us that even if she can’t spell she can try to sound e first letter. Never give up easily and she really love school so much! We are really happy that she had not just grown in her learning but also in her values!,0.33564814814814814,Topic 1,"['teacher', 'school', 'child', 'kid', 'care', 'principal', 'good', 'son', 'time', 'parent', 'centre', 'day', 'go', 'thank', 'year', 'love', 'like', 'daughter', 'month', 'take']",MindChamps PreSchool @ Toa Payoh
Very exciting graduation ceremony.,0.39,Topic 1,"['teacher', 'school', 'child', 'kid', 'care', 'principal', 'good', 'son', 'time', 'parent', 'centre', 'day', 'go', 'thank', 'year', 'love', 'like', 'daughter', 'month', 'take']",MindChamps PreSchool @ Toa Payoh
"My child commenced early education at pre-school in the early part of this year and it is evident that he is gradually acclimatizing to the school environment. To share few area so far: - The facilities are outstanding, with a safe and engaging play area, clean and spacious classrooms, and numerous educational toys and materials. - Lin Lao Shi and Miss Charlene are knowledgeable, experienced, and caring, which creates a warm and nurturing environment that fosters learning and growth. - The timely communication between the school and parents is excellent, with regular updates and feedback on the child's progress and development, which helps parents stay involved and informed. - The school staff especially, Miss Say Li is also very accommodating and flexible, working with parents to address any concerns or issues that may arise, and providing excellent customer service. Please keep up the good work!",0.3600877192982457,Topic 0,"['teacher', 'child', 'school', 'kid', 'love', 'parent', 'staff', 'thank', 'environment', 'learn', 'care', 'good', 'ms', 'preschool', 'nurture', 'experience', 'activity', 'daughter', 'fun', 'provide']",MindChamps PreSchool @ Toa Payoh
"My son love the school! even after we moved house, we are still going back to the same school.",0.20833333333333334,Topic 1,"['teacher', 'school', 'child', 'kid', 'care', 'principal', 'good', 'son', 'time', 'parent', 'centre', 'day', 'go', 'thank', 'year', 'love', 'like', 'daughter', 'month', 'take']",MindChamps PreSchool @ Toa Payoh
"MindChamps TPY has a spacious area for the champs activities. Their indoor playground is especially loved by my child. They have structure curriculum plan for the champs, the Teachers are friendly and responsive. However there is rather high turn over rate in the Teachers and staff especially last year (2022). We hope the management can improve this area to maintain good quality of teaching.",0.44699999999999995,Topic 0,"['teacher', 'child', 'school', 'kid', 'love', 'parent', 'staff', 'thank', 'environment', 'learn', 'care', 'good', 'ms', 'preschool', 'nurture', 'experience', 'activity', 'daughter', 'fun', 'provide']",MindChamps PreSchool @ Toa Payoh
My girl had a great time during her time in Mindchamps! Learning had been fun!,0.6875,Topic 0,"['teacher', 'child', 'school', 'kid', 'love', 'parent', 'staff', 'thank', 'environment', 'learn', 'care', 'good', 'ms', 'preschool', 'nurture', 'experience', 'activity', 'daughter', 'fun', 'provide']",MindChamps PreSchool @ Toa Payoh
