Comment,Sentiment,Topic_Number,Word,Preschool_Name
"The teachers at mindchamps are very friendly and caring. The children are very happy to go to school every day, where they meet new friends and learn to do things independently. I feel relieved to put my children here. My children have graduated from PG. I have been attending school here since the beginning. It is a very loving school.",0.48077272727272735,Topic 1,"['teacher', 'school', 'child', 'kid', 'care', 'principal', 'good', 'son', 'time', 'parent', 'centre', 'day', 'go', 'thank', 'year', 'love', 'like', 'daughter', 'month', 'take']",MindChamps PreSchool @ Paragon
"Responsible, good attitude, disease and health control in place, sufficient teachers""",0.44999999999999996,Topic 1,"['teacher', 'school', 'child', 'kid', 'care', 'principal', 'good', 'son', 'time', 'parent', 'centre', 'day', 'go', 'thank', 'year', 'love', 'like', 'daughter', 'month', 'take']",MindChamps PreSchool @ Paragon
"""We are the parents of Elijah and Ethan who both graduated from MindChamps and we have found it a wonderful experience for both us and our kids. There is a vibrant spread of activities from music lessons, gourmet food sessions and more. The amazing support from the school staff and other parents also helped our children on their journey. The teachers in Mindchamps are also very patient and all the knowledge they taught our children has really made us parents proud. Kudos especially to Xue Laoshi, Ms Steph, Ms Ellie and of course, the principal, Ms Chris for their exceptional performance. All in all, it has been great for our entire family at Mindchamps!",0.40069444444444446,Topic 0,"['teacher', 'child', 'school', 'kid', 'love', 'parent', 'staff', 'thank', 'environment', 'learn', 'care', 'good', 'ms', 'preschool', 'nurture', 'experience', 'activity', 'daughter', 'fun', 'provide']",MindChamps PreSchool @ JTC Summit
Best kindergarten wonderful teachers and great curriculum management always coming up with new ideas The main two things my son benefited was having a nurturing environment.. and it unearthing a love for music we didn’t know possible. One of the more expensive in SG but still worth it.,0.39030303030303026,Topic 0,"['teacher', 'child', 'school', 'kid', 'love', 'parent', 'staff', 'thank', 'environment', 'learn', 'care', 'good', 'ms', 'preschool', 'nurture', 'experience', 'activity', 'daughter', 'fun', 'provide']",MindChamps PreSchool @ JTC Summit
"Our family truly appreciate for all the teachers in Mindchamps JTC, for their endless efforts and responsibilities. We just moved to Singapore and Mindchamps JTC was our daughter's the very first school. With Mindchamps JTC, our daughter was able to well adapt to new culture and environment, and allowed our family to have great start in Singapore. Teachers were great for creating warm-hearted atmosphere, and our kid was having no resistance towards learning new languages. Thank you for always welcoming us with smiles every day morning. With Mindchamp JTC, our daughter learned both English and Chinese very quickly, and I was fully satisfied with all the classes, including music class and extra excursions.",0.29217171717171714,Topic 0,"['teacher', 'child', 'school', 'kid', 'love', 'parent', 'staff', 'thank', 'environment', 'learn', 'care', 'good', 'ms', 'preschool', 'nurture', 'experience', 'activity', 'daughter', 'fun', 'provide']",MindChamps PreSchool @ JTC Summit
"Both Amilia and Angelia have graduated from Mindchamps JTC in 2020 and 2023. It has been a truly pleasant learning journey for both of them in Mindchamps, the teachers are professional and takes good care of the girls for the years they were there. I really like the school environment and curriculum as well. The girls love the school and always look forward to it. It is a pre-school I highly recommend for any parents who want their children to have a great learning, safe and well cared environment! Special thanks to Ms Chris, Ms Eille, Teacher Stephanie and Xue Lao Shi!",0.442547619047619,Topic 0,"['teacher', 'child', 'school', 'kid', 'love', 'parent', 'staff', 'thank', 'environment', 'learn', 'care', 'good', 'ms', 'preschool', 'nurture', 'experience', 'activity', 'daughter', 'fun', 'provide']",MindChamps PreSchool @ JTC Summit
"We switched preschool 3 years ago when we shifted. Was initially worried about my child's transition to new school. However, the worries are unfound as the principal and teachers here are so professional and are genuinely caring for the kids! My son is always looking forward to go to school! They made school such a nice place for the kids! Best part, the teachers turnover is really low and that says something! Will definitely miss MindChamps @ JTC Summit!",0.29015151515151516,Topic 1,"['teacher', 'school', 'child', 'kid', 'care', 'principal', 'good', 'son', 'time', 'parent', 'centre', 'day', 'go', 'thank', 'year', 'love', 'like', 'daughter', 'month', 'take']",MindChamps PreSchool @ JTC Summit
"We have sent all our three kids to Mindchamps JTC since 2012. The current management - principal and teachers have shown great level of professionalism, sincere care, love for our children. Some teachers have seen all our three kids grown and blossom over the years. A special shout out to Ms Chris, Ms Ellie, Ms Steph, and Xue Lao shi, Ms Alicia, Ms Lorraine for taking such good care of our three kids throughout their preschool years. No regrets sending all our kids to the school. We would definitely miss you all lots from next year onwards as our third kid graduate this year!",0.26428571428571423,Topic 0,"['teacher', 'child', 'school', 'kid', 'love', 'parent', 'staff', 'thank', 'environment', 'learn', 'care', 'good', 'ms', 'preschool', 'nurture', 'experience', 'activity', 'daughter', 'fun', 'provide']",MindChamps PreSchool @ JTC Summit
"we sent both our kids from PG to K2 to this branch. fantastic teachers, support staff and principal. 10/10 would send another kid if we get a third one.",0.2,Topic 1,"['teacher', 'school', 'child', 'kid', 'care', 'principal', 'good', 'son', 'time', 'parent', 'centre', 'day', 'go', 'thank', 'year', 'love', 'like', 'daughter', 'month', 'take']",MindChamps PreSchool @ JTC Summit
"We chose MindChamps PreSchool @ JTC Summit based on a friend's recommendation, and my son Cola has been studying here for two years. It's been the best decision we've made, as the growth in my son's development at this school is evident. He initially had difficulty speaking up in school, but with the principal's assistance, he eventually started to communicate with teachers and classmates. She put in a lot of effort during this process, and we are very grateful and feel fortunate to have encountered such a great principal. The teachers are also excellent; our son often surprises us with what he's learned at school, including life skills, sports, hobbies, and academic subjects. Once again, thank you to MindChamps PreSchool @ JTC Summit.",0.4055555555555556,Topic 0,"['teacher', 'child', 'school', 'kid', 'love', 'parent', 'staff', 'thank', 'environment', 'learn', 'care', 'good', 'ms', 'preschool', 'nurture', 'experience', 'activity', 'daughter', 'fun', 'provide']",MindChamps PreSchool @ JTC Summit
It’s been almost 3 years since we switched preschool to JTC MindChamps. The principal and teachers here are more professional and trained in many areas to teach and guide. They are understanding to my child needs and are able to help him to realize his potential. They genuinely care about the well being of the child. My son is very happy to go to school and has never cried about not wanting to go to school since we switched over here. Highly recommend JTC MindChamps to any parents as it also walking distance to shopping malls and CPF building where there are a few extra curriculum classes that you can enroll your child.,0.296,Topic 1,"['teacher', 'school', 'child', 'kid', 'care', 'principal', 'good', 'son', 'time', 'parent', 'centre', 'day', 'go', 'thank', 'year', 'love', 'like', 'daughter', 'month', 'take']",MindChamps PreSchool @ JTC Summit
Very caring principal and teachers who you can tell care for the children. Especially thankful for the care over the years for my kids. Will be sad to leave after my kids graduate !,-0.14166666666666666,Topic 1,"['teacher', 'school', 'child', 'kid', 'care', 'principal', 'good', 'son', 'time', 'parent', 'centre', 'day', 'go', 'thank', 'year', 'love', 'like', 'daughter', 'month', 'take']",MindChamps PreSchool @ JTC Summit
"Mindchamp teachers have been very professional and patient in guiding our daughter progress in pre-school. We can observe significant improvement especially in her chinese language and other aspects too. We would like to compliment the principal and teachers who constantly provide child progress updates, photos and event reminders to parent through mindchamp apps for us to know how our daughter is doing in school recently. We are glad that we have made the right decision to switch her to Mindchamps JTC.",0.1295238095238095,Topic 0,"['teacher', 'child', 'school', 'kid', 'love', 'parent', 'staff', 'thank', 'environment', 'learn', 'care', 'good', 'ms', 'preschool', 'nurture', 'experience', 'activity', 'daughter', 'fun', 'provide']",MindChamps PreSchool @ JTC Summit
"I am writing to express my appreciation for the outstanding care and education provided by JTC MindChamps pre-school. My child has been enrolled since N1, and I have been thoroughly impressed with the level of dedication and passion exhibited by Principal Ms. Chris and all the teachers. The teachers create a safe and nurturing environment that fosters learning and growth. They are kind and enthusiastic, which has a positive impact on the children's development. My child looks forward to going to school every day, and I am grateful for the positive experience she has had. I appreciate how transparent the staff is about the events and situations in the school. They are open and honest about any concerns or issues that may arise, which is reassuring as a parent. The curriculum they have in place is strong and provides a solid foundation for the children. I have seen a noticeable improvement in my child's skills and knowledge since starting with the JTC MindChamps. Furthermore, the teachers takes parents' feedback sincerely and makes necessary adjustments to provide the best possible learning and enjoyable experience for the children. The level of communication they have with parents is excellent, and I am grateful for the genuine interest they take in the children's development. I would highly recommend JTC MindChamps to anyone looking for a pre-school that provides exceptional care and education. Thank you to Principal Ms. Chris, Ms. Ellie, K2 teachers Ms. Steph, and Xue Laoshi, and the entire team for all your care and guidance in shaping our children's future.",0.3875889328063241,Topic 0,"['teacher', 'child', 'school', 'kid', 'love', 'parent', 'staff', 'thank', 'environment', 'learn', 'care', 'good', 'ms', 'preschool', 'nurture', 'experience', 'activity', 'daughter', 'fun', 'provide']",MindChamps PreSchool @ JTC Summit
Mindchamps has been instrumental in educating my daughter Nicole. Mindchamps teachers and principal have shown genuine interest and care towards my daughter. My daughter lost her mom at a very young age and its great that the teachers and principal have been mindful of that and have gone beyond their call of duty to care for Nicole and provide hope and concern towards her. I’m very happy that Nicole is growing up well and will be graduating this year. We’ll always be grateful to the JTC Mindchamps staff.,0.5825,Topic 0,"['teacher', 'child', 'school', 'kid', 'love', 'parent', 'staff', 'thank', 'environment', 'learn', 'care', 'good', 'ms', 'preschool', 'nurture', 'experience', 'activity', 'daughter', 'fun', 'provide']",MindChamps PreSchool @ JTC Summit
"Both of my children were enrolled in Mindchamps JTC since Nursery. Thumbs up to the principal Ms Chris and all the teachers who played a crucial role in my children’s preschool life. The Mindchamps app allows the teachers and parents to communicate freely, pictures and descriptions of weekly learning are also uploaded timely.",0.2,Topic 0,"['teacher', 'child', 'school', 'kid', 'love', 'parent', 'staff', 'thank', 'environment', 'learn', 'care', 'good', 'ms', 'preschool', 'nurture', 'experience', 'activity', 'daughter', 'fun', 'provide']",MindChamps PreSchool @ JTC Summit
Reviewing based on my experience since Jun 21. The Center is situated inside a business complex and has a sheltered pick-up/drop-off point which is essential for bad weather and has a sheltered walkway to MRT. Ms Chris (The Center Principal) have done well in ensuring the center hygiene and personal well-being. The Center encourages creativity and instills confidence while imparting the basic to the children. Would like to extend my appreciation for Ms Steph and 李老师 for their effort in bringing the best of the children during the past year. Tribute to them for pushing my little one to explore outside her comfort zone. They were also quick to point out any issue and suggest solutions to improve the children’s learning or character building (when needed).,-0.03601190476190478,Topic 0,"['teacher', 'child', 'school', 'kid', 'love', 'parent', 'staff', 'thank', 'environment', 'learn', 'care', 'good', 'ms', 'preschool', 'nurture', 'experience', 'activity', 'daughter', 'fun', 'provide']",MindChamps PreSchool @ JTC Summit
"All teachers here are very responsible and care about the kids, and my child like teachers and classmates here, had fun and learned a lot in a year after he joined JTC mindchamp, great experience here",0.45333333333333337,Topic 0,"['teacher', 'child', 'school', 'kid', 'love', 'parent', 'staff', 'thank', 'environment', 'learn', 'care', 'good', 'ms', 'preschool', 'nurture', 'experience', 'activity', 'daughter', 'fun', 'provide']",MindChamps PreSchool @ JTC Summit
MindChamps Preschool @ JTC Summit is the ideal school for my child in every aspect. The Principal and Teachers’ dedication in providing educational and fun curriculum to realise my child’s full potential are evident in every interaction. I am really glad that I had chosen MindChamps Preschool @ JTC Summit for my child.,0.36428571428571427,Topic 0,"['teacher', 'child', 'school', 'kid', 'love', 'parent', 'staff', 'thank', 'environment', 'learn', 'care', 'good', 'ms', 'preschool', 'nurture', 'experience', 'activity', 'daughter', 'fun', 'provide']",MindChamps PreSchool @ JTC Summit
"Been almost 3 years with JTC Mindchamp , my son been enjoyed himself so much . All teachers and principal communicate well with parents and great curriculums for the children’s.",0.5,Topic 0,"['teacher', 'child', 'school', 'kid', 'love', 'parent', 'staff', 'thank', 'environment', 'learn', 'care', 'good', 'ms', 'preschool', 'nurture', 'experience', 'activity', 'daughter', 'fun', 'provide']",MindChamps PreSchool @ JTC Summit
My daughter has been with mindchamps JTC summit branch since play group days. She has enjoyed herself and love ❤️ her principal Ms Chris and teachers very much!,0.44166666666666665,Topic 0,"['teacher', 'child', 'school', 'kid', 'love', 'parent', 'staff', 'thank', 'environment', 'learn', 'care', 'good', 'ms', 'preschool', 'nurture', 'experience', 'activity', 'daughter', 'fun', 'provide']",MindChamps PreSchool @ JTC Summit
Amazing staff with so much heart and caring mindset. Its wonderful seeing our daughter get excited about going to Mindchamps. We couldn’t be happier with our kindergarten choice.,0.54375,Topic 0,"['teacher', 'child', 'school', 'kid', 'love', 'parent', 'staff', 'thank', 'environment', 'learn', 'care', 'good', 'ms', 'preschool', 'nurture', 'experience', 'activity', 'daughter', 'fun', 'provide']",MindChamps PreSchool @ JTC Summit
My daughter has been in JTC preschool since N1. Teachers are very responsive and my daughter truly enjoys her school life here till K2 now.,0.2,Topic 1,"['teacher', 'school', 'child', 'kid', 'care', 'principal', 'good', 'son', 'time', 'parent', 'centre', 'day', 'go', 'thank', 'year', 'love', 'like', 'daughter', 'month', 'take']",MindChamps PreSchool @ JTC Summit
"Today is the last day Jodie attends lesson at Mindchamps Preschool@JTC Summit. Next mon she will embarks new chapter of her school life. Time flies really fast. Appreciate all the guidances and teaching that Ms. Christ, Ms. Nisha, Ms. Ellie, Ms. Geetha and Huang Laoshi give to Jodie. We very glad that 2 years ago we make the decision to switch to Mindchamps. We can see a lot of improvement in Jodie. 2020 is a challenging year with COVID-19 pandemic. Mindchamps Teachers are very creative to come out with the K2 Virtual Graduation program. Thanks for the valuable memories that you gave to Champs for them to remember their preschool experience.",0.29204545454545455,Topic 1,"['teacher', 'school', 'child', 'kid', 'care', 'principal', 'good', 'son', 'time', 'parent', 'centre', 'day', 'go', 'thank', 'year', 'love', 'like', 'daughter', 'month', 'take']",MindChamps PreSchool @ JTC Summit
My daughter has joined JTC family since PG :) the teachers are very patient and experienced. 5 star recomendation,0.5,Topic 0,"['teacher', 'child', 'school', 'kid', 'love', 'parent', 'staff', 'thank', 'environment', 'learn', 'care', 'good', 'ms', 'preschool', 'nurture', 'experience', 'activity', 'daughter', 'fun', 'provide']",MindChamps PreSchool @ JTC Summit
"Very caring teachers, good curriculum, well organised and nice environment for our kids, many thanks to the mindchamps jtc team of teachers and staff :)",0.45,Topic 0,"['teacher', 'child', 'school', 'kid', 'love', 'parent', 'staff', 'thank', 'environment', 'learn', 'care', 'good', 'ms', 'preschool', 'nurture', 'experience', 'activity', 'daughter', 'fun', 'provide']",MindChamps PreSchool @ JTC Summit
Overall experience is excellent. My daughter enjoyed coming to school everyday.,0.325,Topic 0,"['teacher', 'child', 'school', 'kid', 'love', 'parent', 'staff', 'thank', 'environment', 'learn', 'care', 'good', 'ms', 'preschool', 'nurture', 'experience', 'activity', 'daughter', 'fun', 'provide']",MindChamps PreSchool @ JTC Summit
Great,0.8,Topic 0,"['teacher', 'child', 'school', 'kid', 'love', 'parent', 'staff', 'thank', 'environment', 'learn', 'care', 'good', 'ms', 'preschool', 'nurture', 'experience', 'activity', 'daughter', 'fun', 'provide']",MindChamps PreSchool @ JTC Summit
"The teachers are serious and responsible, the principal is very hands-on, and the children will grow up healthily and happily😀 """,0.14166666666666666,Topic 1,"['teacher', 'school', 'child', 'kid', 'care', 'principal', 'good', 'son', 'time', 'parent', 'centre', 'day', 'go', 'thank', 'year', 'love', 'like', 'daughter', 'month', 'take']",MindChamps PreSchool @ JTC Summit
"""great location""",0.8,Topic 0,"['teacher', 'child', 'school', 'kid', 'love', 'parent', 'staff', 'thank', 'environment', 'learn', 'care', 'good', 'ms', 'preschool', 'nurture', 'experience', 'activity', 'daughter', 'fun', 'provide']",MindChamps PreSchool @ Straits View
"""My kid has been enrolled with the center for around 2 years. She is happy to go to school every day. Her class teacher Ms. Phoebe and Wang Laoshi are very capable and dedicated.",0.32,Topic 1,"['teacher', 'school', 'child', 'kid', 'care', 'principal', 'good', 'son', 'time', 'parent', 'centre', 'day', 'go', 'thank', 'year', 'love', 'like', 'daughter', 'month', 'take']",MindChamps PreSchool @ Holland Village
The curriculum is good but the environment is not so homely and lack of personal touch. My daughter was absent for many days and hospitalised but there wasn’t a single call from school to check on her. I don’t see principal greeting students in the morning like what other kindergarten does. The checkers (normally not the teachers)will do health check with a serious face and normally doesn’t greet good morning to students. I personally feel the childcare was managed like an enterprise than a school. I have no doubt the curriculum is good but I do hope the environment can be more nurturing.,0.22043650793650796,Topic 1,"['teacher', 'school', 'child', 'kid', 'care', 'principal', 'good', 'son', 'time', 'parent', 'centre', 'day', 'go', 'thank', 'year', 'love', 'like', 'daughter', 'month', 'take']",MindChamps PreSchool @ Holland Village
This branch is great. They have a very hands on and communicative principal. This photo is from an off site family day full of activities,0.45,Topic 1,"['teacher', 'school', 'child', 'kid', 'care', 'principal', 'good', 'son', 'time', 'parent', 'centre', 'day', 'go', 'thank', 'year', 'love', 'like', 'daughter', 'month', 'take']",MindChamps PreSchool @ Holland Village
"My kid has been enrolled in N1 level of MC @ Holland V for around eight months, and we can see great progress of her during the past months. The school has an excellent team with outstanding leadership and nice teachers. The school events and daily activity are very-well designed and considerable. The teachers of my kid are very experienced and show great care to kids. Recently, my kid is very stressful because of her newborn brother, and her teachers spend a lot of efforts in helping her to get through this difficult time. We’re very much appreciated about this. With the help of the teachers, she gradually starts to show love and care to her young brother. The teachers have also shared a lot of parenting skills with me, which are really useful!",0.3390625,Topic 0,"['teacher', 'child', 'school', 'kid', 'love', 'parent', 'staff', 'thank', 'environment', 'learn', 'care', 'good', 'ms', 'preschool', 'nurture', 'experience', 'activity', 'daughter', 'fun', 'provide']",MindChamps PreSchool @ Holland Village
"We have been with the school for over 4 years since our eldest joined in PG. Our kids are well taken care of and they have learned so much through interesting and fun ways! We truly appreciate the camaderie of the team led by Ms Valarie and Ms Alina. It is this warm ""kampung"" spirit that one can feel the moment you step into the school, that led to the decision to choose this preschool 🥰 thank you teachers!",0.45625,Topic 0,"['teacher', 'child', 'school', 'kid', 'love', 'parent', 'staff', 'thank', 'environment', 'learn', 'care', 'good', 'ms', 'preschool', 'nurture', 'experience', 'activity', 'daughter', 'fun', 'provide']",MindChamps PreSchool @ Holland Village
Our son is very comfortable and enjoys going to school at MindChamps @ Holland Village. He comes home singing of the songs taught in school and talks frequently about his friends and teachers in school. He has grown tremendously in school and has become a sociable and friendly boy.,0.33208333333333334,Topic 1,"['teacher', 'school', 'child', 'kid', 'care', 'principal', 'good', 'son', 'time', 'parent', 'centre', 'day', 'go', 'thank', 'year', 'love', 'like', 'daughter', 'month', 'take']",MindChamps PreSchool @ Holland Village
"Great place for babies, toddlers and kids. My kid loves going to school.",0.8,Topic 1,"['teacher', 'school', 'child', 'kid', 'care', 'principal', 'good', 'son', 'time', 'parent', 'centre', 'day', 'go', 'thank', 'year', 'love', 'like', 'daughter', 'month', 'take']",MindChamps PreSchool @ Holland Village
"All my 3 kids went to Mindchamps. I love their curriculum, it’s a very holistic education that they provide. Including music and violin lessons.",0.35,Topic 0,"['teacher', 'child', 'school', 'kid', 'love', 'parent', 'staff', 'thank', 'environment', 'learn', 'care', 'good', 'ms', 'preschool', 'nurture', 'experience', 'activity', 'daughter', 'fun', 'provide']",MindChamps PreSchool @ Holland Village
"Well run, excellent teachers and facilities! Like a big family.",0.5,Topic 0,"['teacher', 'child', 'school', 'kid', 'love', 'parent', 'staff', 'thank', 'environment', 'learn', 'care', 'good', 'ms', 'preschool', 'nurture', 'experience', 'activity', 'daughter', 'fun', 'provide']",MindChamps PreSchool @ Holland Village
Conducive environment for kids to learn. Curriculum is rich and we appreciate the nurturing and patient teachers.,0.375,Topic 0,"['teacher', 'child', 'school', 'kid', 'love', 'parent', 'staff', 'thank', 'environment', 'learn', 'care', 'good', 'ms', 'preschool', 'nurture', 'experience', 'activity', 'daughter', 'fun', 'provide']",MindChamps PreSchool @ Holland Village
"My elder boy was well-cared for and enjoyed his preschool years (from N1 to K2) at Mindchamps Holland V. So we have enrolled our younger boy in Playgroup and look forward to seeing him grow and strive in the same environment. Thank you to the wonderful Teachers and Staff who are supportive, helpful and caring! The location is also very accessible, just a short walk (sheltered) from Holland Village MRT station.",0.37321428571428567,Topic 0,"['teacher', 'child', 'school', 'kid', 'love', 'parent', 'staff', 'thank', 'environment', 'learn', 'care', 'good', 'ms', 'preschool', 'nurture', 'experience', 'activity', 'daughter', 'fun', 'provide']",MindChamps PreSchool @ Holland Village
"Our Daughter has been at MindChamps Preschool @ Holland Village from the age of 18 months through to K2 graduation, and we have nothing but positive things to say about the school and all its staff. The leadership and Teachers all genuinely care about the kids and our little one has thrived as a result. I am grateful to all that have played a part in her development.",0.1465909090909091,Topic 0,"['teacher', 'child', 'school', 'kid', 'love', 'parent', 'staff', 'thank', 'environment', 'learn', 'care', 'good', 'ms', 'preschool', 'nurture', 'experience', 'activity', 'daughter', 'fun', 'provide']",MindChamps PreSchool @ Holland Village
