Preschool_Name,Comment,Sentiment,Noun,Word,Category
Camelot River Valley," A terrific daycare centre! The teachers are lovely and so caring - impressive that they know literally every single kid by name! We haad a great experience here, the only reason we left is because of the distance from the apartment we moved to. I need to also mention Mel who is the most dedicated principal ive ever met. No question or issue was ever too difficult for Mel. A lovely person all round and an asset to Camelot!",0.2237012987012987,,daycare,
Camelot River Valley," I am just ecstatic, satisfied and feeling accomplished that I found a gem! I",0.375,,feeling,Educational Management and Organization
Camelot River Valley,"My daugter had a great time growing up at the school. Administration team was so fast and efficient, and teachers alwasy provide great creative classes. Thank you so much !",0.51,,daugter,
Camelot River Valley,"We are really happy with Camelots, they are doing a great job. :)",0.7000000000000001,,camelot,
Carpe Diem @ 78 Yio Chu Kang,I shifted to another branch nearer to my house.,0.0,,branch,Educational Institutions and Facilities
Carpe Diem @ Fajar Road,"Tevie joined the school since N1(2020). We appreciate that the teachers assist Tevie in toilet train, stop milk bottle feeding and be more independent in many more aspects.",0.29333333333333333,,tevie,
Carpe Diem @ Hilltop Pte Ltd,"Really love the compound and outdoor play time they have. My lo would play in the playground while waiting for me to pick up. His chinese teacher, who had left the school, was really good.",0.3,,compound,Educational Resources and Materials
Carpe Diem @ Hilltop Pte Ltd,"Wonder why they didnt request to add a pavement from main road to gate. Pretty dangerous for both drivers and pedestrians. At least, put drain covers.",-0.12083333333333333,,pavement,
Carpe Diem @ Jurong Kechil, Carpe diem child care centre,0.0,,diem,
Carpe Diem @ Parkway Centre Pte Ltd,"I'm delighted to express my satisfaction with Carpe Diem,",0.7,,satisfaction,
Carpe Diem @ Parkway Centre Pte Ltd,"Shannon, impresses with her well-rounded education and leadership. In summary, my experience has been overwhelmingly positive at this childcare centre.",0.22727272727272727,,impress,
Carpe Diem @ Petir,"It is located at Blk 167 Petir Road.There is a nice children play ground beside it, also a coffee shop beside the play ground.It provides conveniency for residents around the neighbourhood. Dated : 09/06/2017 (Sunday).",0.6,,ground,
Carpe Diem Schoolhouse Pte Ltd (5 Toh Yi Drive),The murals outside this place is amazing.,0.30000000000000004,,mural,
Carpe Diem Springs Preschool,Carpe Diem Springs Preschool is a great option.,0.8,,option,Educational Management and Organization
Carpe Diem Springs Preschool,I love the 8 multiple intelligences concept and the teachers taught my children many things while adhering to this concept. The school also helps to prepare the k2 students for p1 so that the transition for the kids is as smooth as possible. Never regretted or looked back on my decision. Thank you teachers and staff of Carpe Diem Springs!,0.2333333333333333,,concept,Educational Management and Organization
Chatsworth Preschool - Piccadilly Campus,"In my plea to let my son stay on in school,",0.0,,plea,
Chatsworth Preschool - Piccadilly Campus,"While I understand speech and developmental delays that my son has,",0.0,,speech,Learning and Teaching
Chatsworth Preschool - Piccadilly Campus," Squirrels, trees, fallen leaves on the path and mystical ambience, where nature stays true to everyone, welcoming children to spend their beginnings with friends and laughters.",0.35,,tree,
Chatsworth Preschool - Piccadilly Campus, Beautiful campus set in the aerospace park. Wonderful staff and faculty. My son loves his new school!,0.6734848484848485,,campus,Educational Institutions and Facilities
Chatsworth Preschool - Piccadilly Campus, Well rounded mix of education and play; staff (not just the teachers) who genuinely seem to care for children; good mix of kids; proper English spoken : no Singlish; actual school grounds that are useable and are used; could be Singapore's last kindergarten in a countryside setting. This observation made : 2013.,0.18333333333333335,,mix,Learning and Teaching
Cherie Hearts @ Charlton Pte Ltd,"I really felt included and appreciated among friends and teachers there. The food was nicely cooked and always served on time, they also give us time for play which was very much appreciated. Helping us stay active and make friends through our play. In summary it was a really fruitful experience and journey with Cherie Hearts and would definitely recommend to all parents and future parents. Thank you 🙏,",0.15833333333333333,,friend,Educational Roles
Cherie Hearts @ Charlton Pte Ltd,"Brands the Centre director and teachers gave me regular updates and photos to assure us how they are doing and put them inside the office to ensure they are comfortable and not disturbing other kids. They do this when the boys are unwell or need calming down due to adjustment / separation issues,",0.040740740740740744,,brand,
Cherie Hearts @ Charlton Pte Ltd,Young Entrepreneur Day cum Start Small Dream Big - Charity Drive and Family Day cum Children’s Day.,-0.049999999999999996,,cum,
Cherie Hearts @ Charlton Pte Ltd,"Today, we attended the centre's 20th Anniversary & annual concert,",0.0,,today,
Cherie Hearts @ Charlton Pte Ltd,our area which she does not fit in.,-0.2,,area,Educational Resources and Materials
Cherie Hearts @ Charlton Pte Ltd,We have never felt more at ease when we dropped off our daughter every morning.,0.5,,ease,
Cherie Hearts @ Charlton Pte Ltd,Happy 20th anniversary and many more years to come.,0.45,,anniversary,
Cherie Hearts @ Charlton Pte Ltd," Hi, my son attended this childcare many years back however I remembered it vividly. I was told the incidents of HFMD was minimal however the exact month my son was there, he was down with HFMD, and on the 3rd month too. During one incident when he was down with fever, the teacher locked him up in the room on L2 till dismissal (when they should have just called us to pick him up earlier). Few months later, we observed bruise marks on his arms on a few occasions. The principal and teacher said it’s due to “play with other students”. After so many unpleasant incidents, we decided to forego the deposit and take my boy out from Cherie Hearts at Charlton. How would we even want to continue that last month (after reporting these unpleasant incidents to the principal and teacher)?",-0.054783950617283944,,incident,
Cherie Hearts @ Charlton Pte Ltd,"These kind of experiences can leave scars on children for years! In fact, they even leave psychological scars / guilt on parents - I’ll think why I gave this childcare centre so many chances? What else happened to my kid (prior to my discovery?). Could all these be avoided if only I trusted my gut feel, (as well as granny’s observation outside the centre) and take him out earlier?",0.17857142857142858,,scar,
Cherie Hearts @ Charlton Pte Ltd,Cherie Heart is certainly an important part of MK's childhood with many invaluable learning experiences.,0.45,,childhood,Students
Cherie Hearts @ Charlton Pte Ltd,Once again we are thankful for everything. We wish you health and happiness for the many years to come.,0.6,,health,
Cherie Hearts @ Charlton Pte Ltd,I have no regrets with choosing this place to be his second home.,0.025,,regret,Emotions and Values in Education
Cherie Hearts @ Charlton Pte Ltd, Today’s performance was really a success! I’ve enjoyed all the performance by the kids and was very touched by the big kids (alumni) who came back to show love & support of Cherie Hearts @ Charlton 20 years anniversary.,0.2625,,performance,Activities and Events
Cherie Hearts @ Charlton Pte Ltd,"I am also grateful that they can accommodate allergies for lunch. (During the viewing, we knew that some preschools do not offer allergy-friendly meals.) CCTV,",0.0,,allergy,
Cherie Hearts @ Charlton Pte Ltd,"Daily notification of what children learned, regular personal interviews, these are some of the things that make me feel safe.",0.125,,notification,
Cherie Hearts @ Charlton Pte Ltd,We also enjoy interactive feedback from the school via their internal platforms and the kind attention that they place on our child.,0.3333333333333333,,feedback,Communication in Education
Cherie Hearts @ Charlton Pte Ltd,"I feel like their teaching is very productive. Another thing that my son likes is their excursions, the school sometimes will bring the children on outings for trips to places, be it the farms, to memorials, firestations, etc and it is something the parents can opt to do with them as well that the kids enjoy a lot.",0.30000000000000004,,teaching,Learning and Teaching
Cherie Hearts @ Charlton Pte Ltd,"Amongst the myriad of preschools available In Singapore, my husband and I felt that we have found a gem in Cherie Hearts at Charlton. We have 2 children currently studying at this school.",0.2,,myriad,
Cherie Hearts @ Charlton Pte Ltd," I was very fortunate to spend six months here for my internship under the guidance of a very warm & encouraging group of staff members. The children were very nice and lovable as well, they were a motivation for me to continue in the industry. The partnership between the school and parents is very strong, which was one of my key take always from this internship.",0.523888888888889,,internship,
Cherie Hearts @ Charlton Pte Ltd,"aspect, physical aspect and emotional aspect, were excellent.",0.3333333333333333,,aspect,
Cherie Hearts @ Charlton Pte Ltd,"First and foremost, we love that there is a good connection between the school and the parents, taking us along the learning journey of our children. We feel at ease especially with the regular and somewhat prompt updates of their weekly activities and matters.",0.29,,connection,Learning and Teaching
Cherie Hearts @ Charlton Pte Ltd,I love that they offer enrichment classes in the school itself so my boy can attend extra classes within school without us having to ferry him to external enrichment lessons. All within the CC timing!,0.16666666666666666,,enrichment,Activities and Events
Cherie Hearts @ Charlton Pte Ltd,"Cherie Hearts Charlton has helped to allay all my fears with their timely updates. Ms Ng is more than just a Branch Director, giving us the support we needed as we prepared ourselves for our last minute decision in schooling our child. She is approachable and always patient in answering my queries.",0.25,,fear,Learning and Teaching
Cherie Hearts @ Charlton Pte Ltd,"Surin Park outings, learning excursions etc)",0.0,,outing,Activities and Events
Cherie Hearts @ Charlton Pte Ltd,The missing 1.0 point is for the following improvement : (1),-0.31666666666666665,,point,
Cherie Hearts @ Charlton Pte Ltd," My parents enrolled me into Cherie Hearts @Charlton when I was 2 years old. I was with them all the way until when I went into P1. All the teachers there were very friendly and taught me lots of interesting stuff, like drawing, simple mathematics, etc. I remembered there was even a once-a-week water play, where we mass around with water and throw water bombs around. Can't remember what's it called. But that was fun! I remember there was even an overseas trip together with the teachers to JB where we spent one night at LegoLand. That was a very memorable trip for me. I was there for 5 years and I truly enjoyed my time there. I have to thank my parents for making the right choice to enrol me into Cherie Hearts@Charlton.",0.31091269841269836,,water,Food in Education
Cherie Hearts @ Charlton Pte Ltd," I like to give a shout out (in appreciation) to Ms Ng , all Teachers and staff at CH@charlton. My older daughter (who is currently in P1 now) joined them mid-way in K1 from another “premium” preschool. At that time, her literacy and reading skills in both languages were poor. With help from the Teachers and their reading program, she made tremendous improvements by term 3 in K2. She even knows hanyu pinyin better than me! Now that she’s in P1, she has no issues in reading, spelling or 听写 because CH@charlton has prepared her well. CH@charlton also has fun activities like messy day (water play)",0.11785714285714285,,reading,Learning and Teaching
Cherie Hearts @ Charlton Pte Ltd,and is reaping the same benefits. I am so glad I’ve made the switch for them.,0.25,,benefit,
Cherie Hearts @ Charlton Pte Ltd,improve the delivery of the lessons during this trying time.,0.0,,delivery,
Cherie Hearts @ Charlton Pte Ltd,"A collective team of teachers and principal that works well hand in hand. The staff knows the students from various classes , as much as the children know the different staff from various levels. I highly recommend this school.",0.072,,hand,
Cherie Hearts @ Charlton Pte Ltd, I had a great practicum experience in this centre as the teachers and staff were nice and patient. They gave good and effective advice for classroom management. There were many things to learn from them regarding the teaching strategies and classroom management skills.,0.6399999999999999,,classroom,Educational Institutions and Facilities
Cherie Hearts @ Charlton Pte Ltd, Very responsible and responsive school. Addresses the concerns directly and not beat around the bush or brushing away the concern.,0.18,,concern,
Cherie Hearts @ Charlton Pte Ltd,Interactions with staffs of different levels have shown a consistent level of genuine care and concern towards the children.,0.21666666666666667,,level,
Cherie Hearts @ Charlton Pte Ltd," During the practicum period of four months ,I learnt alot . The management ,staff everyone nice to me . Treat me like one of them. Envirnoment is very nice",0.69,,practicum,Learning and Teaching
Cherie Hearts @ Charlton Pte Ltd,"I have printed screen shots of your comment in this review, implying my kids to be “Selfish, self centered & inconsiderate”.",-0.5,,screen,
Cherie Hearts @ Charlton Pte Ltd,"To many out there, this lady,",0.5,,lady,Educational Roles
Cherie Hearts @ Charlton Pte Ltd,"Also in the video, you will be able to observe her making statements to the teachers while walking away. She didn’t observe her path and obstacles and that led to her falling down like a log & sustained abrasion on her knee as reflected in her previous Fb posting.",0.031944444444444435,,video,Educational Resources and Materials
Cherie Hearts @ Charlton Pte Ltd,"In a nut shell, everything didn’t fall in place for her that morning & she blamed the school for everything. What kind of human is this.. the more I see her comments implying my kids to be a potential delinquent, the angrier I get! I am seriously looking into pursue legal action on her. I bet this is a very STOMP worthy video too.",0.17777777777777778,,nut,
Cherie Hearts @ Charlton Pte Ltd,"learn through play and experiencing a wide range of artistic, cultural, educational, social and physical activities.",0.10277777777777776,,play,Activities and Events
Cherie Hearts @ Charlton Pte Ltd, Kudos for arranging the 2 days 1 night camp and night cycling! It’s really amazing effort from Cheriehearts to make this happen! Such a great experience for the children! Thank you!,0.5833333333333334,,night,Time in Education
Cherie Hearts @ Charlton Pte Ltd," The playgroup kids were adorable,",0.5,,playgroup,Activities and Events
ChildFirst @ Mountbatten,"Their curriculum is very well structured and systematic, their language immersion (the children HAVE TO communicate in one language (Eng/Chinese) only) for half a day each language, really helped my children gain confidence in speaking in Chinese. Early exposure to robotics and computer lessons also equipped them well.",0.05555555555555556,,language,Communication in Education
ChildFirst @ Mountbatten,Rayden and prepared him well for his life journey ahead! God Bless!,0.0,,life,
Childfirst@Dunearn Pte Ltd," contagious illnesses like hfmd are contained within the class, instd of rapid spread throughout the whole ctr. During the covid years, the sch also managed to control as well as they could. To my personal knowledge, our cases are really much lesser than the ones I heard from my friends. So rest assured the staff in the sch are really vigilant. Also thankful most parents are cooperative & responsible too.",0.18333333333333335,,sch,
Childfirst@Dunearn Pte Ltd,and welcoming.,0.0,,welcoming,
Childfirst@Tampines Pte Ltd,"Spacious, tidy and clean child care facility. The speech and drama room is big with plenty of role play activities for the kids. They also provide coding lessons for N2 to K2. Daily half day Chinese immersion program will helps the kid to have plenty of chances to interact and practice Mandarin. Didn’t give a five as there’s no outdoor activities, all indoor based.",0.13333333333333333,,plenty,
ChildrenÂs Cove Preschool Pte Ltd (Novena), Passionate bunch of teachers. My 2 boys thoroughly enjoy school.,0.17500000000000002,,bunch,Learning and Teaching
Childrenâs Cove Preschool - Orange Grove,"I visited quite a number of childcare centres two years ago, but I'm soooo glad I picked Children's Cove. A big shoutout to Ms. Sherlin,",0.25,,number,Educational Resources and Materials
Childrenâs Cove Preschool - Orange Grove,"Ms. Malar, and Xiao Laoshi for looking after Willow so well.",0.0,,willow,
Childrenâs Cove Preschool - Orange Grove, Just want to get the record straight based on the negative and most likely unjustified and fake comment posted prior. This is an amazing Kinder/Day care with very professional and attentive staff really caring for the kids. My eldest spent 4 years there and my youngest is still enjoying his time at Children's cove so don't make an opinion on one negative comment. Go and visit the place and see by yourself the professionalism and level of attention Children's cove will give to your kids.,0.10230769230769231,,comment,Communication in Education
Children's Cove Preschool - Sembawang,The student-teacher ratio is the lowest with a ratio of 6 to 1 for playgroup.,0.0,,ratio,Educational Resources and Materials
Children's Cove Preschool - Sembawang,"Being new means that all the facilities are clean and in good conditions, all the classrooms and common areas are nicely decorated with warmly theme and child appropriate educational toys.",0.3566287878787879,,mean,
Children's Cove Preschool - Sembawang,At the other end of the school is a door which directly opens and leads to the building’s playground.,-0.012499999999999997,,end,
Children's Cove Preschool - Sembawang,This group of teachers is a gem to cherish.,0.0,,group,Educational Management and Organization
Clementi Woods Kindergarten," Great neighborhood kindergarten, my son spent ~2 years here and he loved it",0.4666666666666666,,neighborhood,Educational Institutions and Facilities
Creative Thinkers Preschool Pte Ltd,R is also educated and has better manners from attending. R looks forward to going to daycare there and is always left in high spirits. R's clothes used to always come back stained at the daycare we attended overseas but at Creative Thinkers R is always kept clean. We love the CTP family!,0.3073809523809524,,r,
Crestar Learning Centre @ Woodlands Civic Centre,"This is run by the same company as Kinderland, the infamous childcare centre that abuses kids! Google it for yourself!",-0.390625,,company,Activities and Events
Da Little Preschool in Tamarind," The teachers here are all very warm and friendly, when I ask questions they answer with reasons for me to understand. The are many toys and gadgets to allow your child to learn in a fun way, some of the toys are creatively made from recyclable materials. This shows how qualified they are for the job. Highly recommend,",0.43583333333333335,,toy,
Eager Kids Montessori,We wish all of you a great success in all your future endeavours and also inspire and train many children.,0.4,,success,Educational Management and Organization
Eager Kids Montessori,"Thank you... Tejaswini,",0.0,,tejaswini,
E-Bridge Pre-School 670 Edgefield Plains,"There are many mosquitoes in the weeds in front of the school. I get bitten every day. The wounds are red, swollen, hard and itchy, and it takes more than a week to heal. There are also many wild dogs gathered under the bridge leading to the bus station outside. They will attack people and bark very loudly, which is very scary. Wild dogs appear at playgrounds and school gates every day, making it very dangerous to pick up and drop off children‼ ️Today I also saw a child being chased by a wild dog. It’s very dangerous⚠️Children in kindergartens will also encounter wild dogs when playing outdoors at school. I don’t know how the school handles it. What if the wild dogs hurt the teachers or children? Why can't it be improved after so long? ? ?",0.034895833333333334,,dog,
E-Bridge Pre-School Pte Ltd (140 Corporation Drive),"Taman Jurong. From the looks of the learning and activity space it has,",0.0,,look,
E-Bridge Pre-School Pte Ltd (140 Corporation Drive)," A premier early childhood centre located in Taman Jurong, 140 Corporation Dr,",0.1,,premier,
E-Bridge Pre-School Pte Ltd (Bukit Panjang Plaza),I like the idea of the new one but I have to say that we will be having an interview,0.13636363636363635,,idea,Educational Management and Organization
ELFA Preschool @ Hougang," It was a wonderful concert! I enjoyed a lot throughout the whole concert. I got emotional (because it's my son's last concert in ELFA Hougang) , smile, laugh and greatful. My son used to be introvert and not a good talker. To my surprise, not only he say his speech with confidence and he's not afraid to be on stage! He dance with the rhythm and focus in the role play as cao chao. I can see all the children having great time to perform the items they had learn for long time and to show them to their family members. I can see teachers had put in lots of effort, love to prepare the children and then shine on stage. Thank you teachers and principal for looking after my son also to support him in the area he is weak at. A big thumb up for the concert! Thank you ELFA Hougang,",0.21333333333333335,,concert,Activities and Events
ELFA Preschool @ Hougang,you all rocks!,0.0,,rock,
ELFA Preschool @ Hougang," Well planned in content, including Chinese drama (from San guo Yan yi)",0.0,,content,Learning and Teaching
ELFA Preschool @ Hougang, English drama instilling positive values in the children through acting and speaking. It is the best preschool concert I've seen so far.,0.2654545454545455,,drama,Educational Management and Organization
ELFA Preschool @ Hougang, Thank you for the great Organisation of this sports fiesta! It was a great experience to see what our kids are capable of and we had a blast!,0.6833333333333332,,sport,
ELFA Preschool @ Hougang,ELFA’s curriculum gave my child a strong foundation in Chinese and it will help his smooth transition to the local primary school. I would recommend ELFA to everyone with little ones.,0.17430555555555557,,elfa,
Eshkol Valley @ Sengkang Pearl Pte Ltd,"My spouse and I seen how our daughter grew to become so independent and the things she learnt there are really broad and sometime in our opinion deep for her age, example identifying all the planets and remembers them, saying all the shapes include ‘rhombus shape’. etc. We too have our son joined the sister and seen him grew in fast pace especially in speech.",0.052500000000000005,,shape,
Eshkol Valley @ Sengkang Pearl Pte Ltd,I saw progress of my daughter really improve in making initiative to speak in mandarin and identifying mandarin words.,0.2,,mandarin,Educational Resources and Materials
Eshkol Valley @ Sengkang Pearl Pte Ltd," Says alot when my son looks forward to school everyday. My two kids went to different preschools and in comparison, i find here to be the better learning environment by a mile and the curiculum more engaging. Teachers are very caring as well. Would definitely give Eshkol Valley Preschool two thumbs-up.",0.2,,alot,
Eshkol Valley @ Sengkang Pearl Pte Ltd,"But as if guided by divine direction, we stumbled upon the “land flowing with milk and honey”, or Eshkol Valley in the bible (confessedly,",0.0,,direction,
Eshkol Valley @ Sengkang Pearl Pte Ltd,"I missed that in my own bible studies..). I must say that the first tour-around experience was the best, not becoz of over-promising or any dazzling opulence to the exterior, but the sincerity, warmth and now well behaved the kids were! Definitely sending!",0.5575,,study,Learning and Teaching
Eshkol Valley @ Sengkang Pearl Pte Ltd,"On top of that, she has gained confidence from being a quiet and shy little one to quite a “performer” and story teller!",-0.05859375,,confidence,Emotions and Values in Education
Eshkol Valley @ Sengkang Pearl Pte Ltd,Values impartation is the next most imp thing that EV has gifted,0.3333333333333333,,value,
EtonHouse Bilingual Pre-School Pte Ltd,Good looking building. It is bery near to FairpriceXpress and 7-11,0.39999999999999997,,building,Educational Institutions and Facilities
EtonHouse Pre-School Pte Ltd (Newton), Went on a merry-go-round yesterday in the estate. Intended to go Eton Preschool but this navi app sent me ti Gilstead road. Luckily the school is along the main road and I self navi my way out.,0.25,,road,Educational Management and Organization
EtonHouse Pre-School Pte Ltd (Newton)," I went to eton back in 2005, it's home to my warmest memories. the teachers were wonderful and kind",0.5333333333333333,,eton,
