Preschool_Name,Comment,Sentiment,Noun,Word,Category
Agape Little Uni Thomson Centre,"My baby girl joined the centre when she was around 1yo, because my Indonesian helper injured her hand and we needed the extra help. I'm really grateful for all the help and love Agape provided for her and the family. They extended their help in applying for additional subsidy due to low income, with frequent updates on the progress and how my child was doing. The infant care was also well structured and my child grew smarter in her time there. I felt really supported in this time of difficulty. Agape was the nearest centre available to join on short notice without a waitlist of 2+ months, probably due to price, but it's really worth it.",0.1318181818181818,,help,Educational Resources and Materials
Agape Little Uni Jurong West Centre,send my qiqif.,0.0,,qiqif,
Agape Little Uni @ Kallang Pte Ltd,Great school. My son loves it here!,1.0,,school,Educational Institutions and Facilities
Agape Little Uni @ Kallang Pte Ltd, Very good and nice,0.7549999999999999,,-,
Agape Little Uni @ Clementi Pte Ltd,Very good quite place nice position and 🔕 …,0.7549999999999999,,position,
Agape Little Uni @ Cecil Pte Ltd,Decided to withdraw my baby after his first day as we decided he was incompatible with the teachers (bad crying even though it was just 2.5hrs in the school) but was still charged the full month amount with no room for negotiations to prorate the amount as I could not give the 14 day notice required in the contract. Just goes to show how much compassion the management actually has. Imagine paying a full month fee for only 2.5hrs of attendance because my baby was incompatible with the care provided by the centre.,0.03125000000000001,,baby,Students
Agape Little Uni @ Cecil Pte Ltd," Terrible attitude. Called to enquire about centre visit, am told that visiting hours are only between 1-2.30pm (kids' nap time). Asked if possible to view other times as classroom interaction and observation of the same would be important considerations for us in assessing a centre's suitability. Front desk person sounded she couldn't be bothered with the enquiry and flatly said they don't allow this (with no further follow up or alternative suggestion on how parents can go about getting more information on classroom dynamics and teacher interaction with students, etc.)",-0.027777777777777776,,centre,Educational Institutions and Facilities
Agape Little Uni @ Cecil Pte Ltd," said ""bye-bye"" on the phone and hung up promptly. TBH if this is the attitude that parents who are cold calling about the centre get,",-0.6,,phone,Educational Management and Organization
Agape Little Uni @ Cecil Pte Ltd,I can't imagine what the situation would be if there was a genuine issue with the centre with an enrolled child. Just terrible and lacking in compassion all round.,-0.26666666666666666,,situation,Educational Resources and Materials
Agape Child Care (CCK) Pte Ltd,"Worst ... principal money face. All the time short of Chinese teachers (no one want to stay long) and cooking auntie , teacher have to be cook and teach at same time, students wash plate themself ....",-0.21000000000000002,,time,
Agape Child Care (CCK) Pte Ltd," Last week,",0.0,,week,Time in Education
Agape Child Care (CCK) Pte Ltd,I visited the childcare centre and all the kids look happy. The childcare centre is built under a bomb shelter. It feels very safe!,0.80625,,childcare,
Adventure Tree Preschool - Holland,Excellent well run preschool with friendly & experienced teachers. The house is well setup inside for different age groups and with pedal karts outside for outdoor play.,0.43499999999999994,,teacher,Educational Roles
Adventure Tree Preschool - Holland,"Breakfast, lunch and snacks are covered by a daily menu.",0.0,,lunch,Food in Education
Adventure Tree Preschool - Holland,My kids have been happy here since starting. Long opening hours when needed. Happy to recommend!,0.4375,,kid,Students
Adventure Tree Preschool - Holland," We love Adventure Tree and the schooling environment it provides for our child. Nurturing, wholesome and friendly. The teachers have our children's best interests at heart and best part our little girl loves going to school every day! We could not have chosen a better school!",0.5442708333333334,,child,Students
Acekidz @ SG Pte Ltd (Yishun), Just joined a couple months back but we have encountered tons of problems!,0.0,,couple,Educational Management and Organization
Acekidz @ SG Pte Ltd (Yishun),"There was no update when we were onboard the school, there was no communication and the teacher wasn't aware of my child's first day of school! The registration was wrong too and they calculated the fee wrongly. Worst case is that once we paid the wrong fee which was way more than we should have paid because my child was registered for half day, they REFUSED to return the fee despite the error from their end!",-0.1636904761904762,,fee,
Acekidz @ SG Pte Ltd (Yishun),There were multiple outbreaks of HFMD and COVID in the span of 2 months when we were there and we ended up not sending our child to school.,0.0,,outbreak,
Acekidz @ SG Pte Ltd (Yishun),It seems there was a change in principals and the handover wasn't done smoothly and no communication was given to the parents.,0.4,,change,Educational Management and Organization
Ace @ Work Childcare Pte Ltd (CCK 757),nice and amazing. Our son is learning a lot and is always excited to go to school even though he,0.525,,son,Educational Roles
Ace @ Work Childcare Pte Ltd (CCK 757),started attending from K1. Thanks for making his learning experience full of fun and interesting.,0.3375,,thank,
Ace @ Work Childcare Pte Ltd (CCK 757)," Centre Teachers are great! No complaints. Will be enrolling my 2nd child here too once he turns 18months. (:,",0.5,,complaint,
Ace @ Work Childcare Pte Ltd (CCK 757), My children learned a lot while in daycare. The teachers are also very responsible and give parents a lot of help. It makes us feel relieved to work outside. Thank you teacher for your hard work and guidance over the past few years. I am very grateful.,-0.04694444444444445,,lot,
Ace @ Work Childcare Pte Ltd (Cashew Heights), My son has been attending this preschool for 1 year (PG last year and now N1),0.0,,year,Time in Education
Ace @ Work Childcare Pte Ltd (Cashew Heights),@ Cashew Crescent has done a fantastic job of this and we are grateful.,0.4,,job,
Ace @ Work Childcare Pte Ltd (Cashew Heights),Post 1 year update. I enrolled my daughter in this school as well. I believe her teachers Ms Jing Xiao Qian and Miss Nicia have guided Sophia to being herself and allowing her talents to come alive. Miss Jing and Miss Nicia are truly dedicated to bringing out the best not just in my kids but in the whole class as well. They spent countless hours in making all these beautiful decorations for Sophia's graduation ceremony and making an unforgettable experience for the children and parents.,0.4071428571428571,,post,
Ace @ Work Childcare Pte Ltd (Cashew Heights),"I should state that I write this as a typical young parent with the same stresses as every other young parent and I can tell u that Miss Jing ,",-0.01833333333333333,,parent,Educational Roles
Ace @ Work Childcare Pte Ltd (Cashew Heights),I am writing this review more to express my gratitude to this wonderful group of teachers and share my experience with other young parents.,0.36875,,review,
Ace @ Work Childcare Pte Ltd (Cashew Heights),This is amazing class! Super good.,0.5944444444444444,,class,
Ace @ Work Childcare Pte Ltd (Cashew Heights)," Our daughter started in the playgroup when she was 26 months old. The wonderful and caring ACE@Work (Cashew Heights) team was there holding our hands through the whole transition. Our now 3 year-old is thriving and has achieved so many of his milestones. With the assistance of every staff member, we believe that our daughter will continue to develop and enhance her social and emotional wellbeing and physical development. We absolutely adore the educators at ACE@Work (Cashew Heights). So glad to have found ACE@Work (Cashew Heights)!",0.2953703703703704,,daughter,Educational Roles
Ace @ Work Childcare Pte Ltd (Cashew Heights)," We made the right decision to move our firstborn over to Ace@Work (cashew heights) from another childcare just before he started N1! The teachers here are encouraging,patient, loving and meticulous! Happy to see my now 5yo enjoying himself in school everyday.",0.44142857142857145,,decision,Educational Management and Organization
Ace @ Work Childcare Pte Ltd (Cashew Heights),Ms Xu and Ms Sharine !,0.0,,m,
Ace @ Work Childcare Pte Ltd (Cashew Heights)," No response,",0.0,,response,Communication in Education
Ace @ Work Childcare Pte Ltd (Cashew Heights)," When we first moved to Dairy Farm two years ago, we were looking for a kindergarten for our son. The nearby kindergartens were either full or not satisfactory to me. Later I found this low-key kindergarten (it was in an apartment complex, and there was very little information about this kindergarten on the Internet at the time). My son has been in this kindergarten for two years. Facts have proved that choosing this kindergarten is very wise. The kindergarten is located in an apartment with a beautiful environment, isolated from the noise and pollution of the main highway. There are many windows, which can keep the air flowing well, and parents can also watch the children attending classes and playing outside the window. The teachers are very, very friendly. The children learned a lot in school and learned Chinese very well! Now that my son K2 is about to graduate,",0.24772435897435893,,kindergarten,
Ace @ Work Childcare Pte Ltd (703 Choa Chu Kang St 53),"I transfered my child to another school due to personal reasons. Despite requesting a transfer certificate, it hasn't been provided. I'm struggling to understand why a transfer certificate cannot be issued when all dues are fully paid. I found, the new principal to be a bit less cooperative. Experienced the same in many other instances (Reason for low rating)",0.1132996632996633,,reason,Educational Resources and Materials
Ace @ Work Childcare Pte Ltd (703 Choa Chu Kang St 53),"I want to acknowledge the positive experience with teachers April and Zhu Laoshi, as well as the former principal,",0.11363636363636363,,experience,Educational Management and Organization
Ace @ Work Childcare Pte Ltd (703 Choa Chu Kang St 53),We so happy with your service. All I can say is thank you.,0.8,,service,Educational Management and Organization
Ace @ Work Childcare Pte Ltd (703 Choa Chu Kang St 53),You and your team have fostered a sense of belonging and community for my little ones. They,-0.1875,,team,Educational Management and Organization
Ace @ Work Childcare Pte Ltd (703 Choa Chu Kang St 53),"Facilities and environment,",0.0,,environment,Educational Resources and Materials
Ace @ Work Childcare Pte Ltd (703 Choa Chu Kang St 53),Teacher Ilah and Pan Lao Shi for their effort in teaching my girl . She really improve alot especially her English and her Chinese . We were sometimes shock with the words she used as it was beyond our thoughts that she can already use and recognized many words . She really enjoy all the actitives in the school especially the outdoors activities and arts and crafts. This school is really creative for always creating,0.2,,word,
Ace @ Work Childcare Pte Ltd (703 Choa Chu Kang St 53),"Altho he still cries during drop offs, i believe he really enjoys going to school cos the teachers mentioned that he didnt cry at all in class.",0.2,,drop,Educational Resources and Materials
Ace @ Work Childcare Pte Ltd (703 Choa Chu Kang St 53),"Shoutout to Pan Laoshi,",0.0,,shoutout,
Ace @ Work Childcare Pte Ltd (703 Choa Chu Kang St 53),This center is doing a great job in developing the future of these kids. In just 4 months of attending this center my son has already learned a lot because everytime I would ask him about school he has so many stories to tell. I can see that he already love going to school. The staff are also friendly and accommodating.,0.28214285714285714,,center,Educational Institutions and Facilities
Ace @ Work Childcare Pte Ltd (703 Choa Chu Kang St 53),They would gladly answer or provide information whenever I have questions or inquiries. One thing I could suggest though is maybe you can update us once in a while about the progress of our son. We sure would love to hear how he is doing in school. Other than that keep up the good work. Thank you.,0.41500000000000004,,information,Educational Management and Organization
Ace @ Work Childcare Pte Ltd (703 Choa Chu Kang St 53)," Already 7 months in N1,",0.0,,month,Time in Education
Ace @ Work Childcare Pte Ltd (703 Choa Chu Kang St 53),Thank you to all the staff in Ace@Work703!,0.0,,staff,Educational Roles
Ace @ Work Childcare Pte Ltd (703 Choa Chu Kang St 53),I would also like to take this time to share that I’ve really enjoyed the many celebrations that Ms Chew have included throughout the entire year and get the kids (and mummies like me) excited! I love that the centre is engaging the kids in many celebrations and activities to make their school day exceptionally fun!,0.40546875,,celebration,Activities and Events
Ace @ Work Childcare Pte Ltd (703 Choa Chu Kang St 53)," The principal,",0.0,,principal,
Ace @ Work Childcare Pte Ltd (703 Choa Chu Kang St 53),"Chew has been a great partner, always there for our queries. She also always reminds us of any events or reminders that us as parents might have missed out. Me and my wife are planning to send our 2nd child there too.",0.4,,partner,Educational Roles
Ace @ Work Childcare Pte Ltd (703 Choa Chu Kang St 53), My toddler enjoys her days at school. I love seeing pictures of her doing activities,0.5,,toddler,Students
Ace @ Work Childcare Pte Ltd (703 Choa Chu Kang St 53),"We can see she got improvement on speaking, learning and know how to interact with other.",-0.125,,improvement,Educational Management and Organization
Ace @ Work Childcare Pte Ltd (703 Choa Chu Kang St 53),She is having fun and learning new things at center. School stuff and principal are nice and keep us update all the time via Diibaer App.,0.23409090909090907,,fun,
Ace @ Work Childcare Pte Ltd (703 Choa Chu Kang St 53),"While I'd greatly prefer more HBL support,",0.65,,support,
Ace @ Work Childcare Pte Ltd (703 Choa Chu Kang St 53)," My grandson is with this care center, the teachers and staff are very professional. I like that its huge rooms, natural ventilation. Great management by manager. 👍 …,",0.266,,grandson,
Ace @ Work Childcare Pte Ltd (703 Choa Chu Kang St 53),This child care centre has a dedicated team who takes good care of the little ones.,0.25625,,care,Emotions and Values in Education
Ace @ Work Childcare Pte Ltd (703 Choa Chu Kang St 53),"Perhaps one thing they can improve on is the ventilation in the centre. As air con is no longer used in the school due to covid, windows are sometimes not sufficiently opened. Small matter really because they are open to feedback and work quickly to rectify issues.",0.03166666666666666,,thing,
Ace @ Work Childcare Pte Ltd (703 Choa Chu Kang St 53),Thank you Ace @ Work!,0.0,,work,
Ace @ Work Childcare Pte Ltd (703 Choa Chu Kang St 53)," Baby enrolled in cck 703 from PG, he is happy and enjoy. Tr Fenny,",0.6000000000000001,,cck,
Ace @ Work Childcare Pte Ltd (703 Choa Chu Kang St 53),"Gardening day,",0.0,,day,Time in Education
Ace @ Work Childcare Pte Ltd (703 Choa Chu Kang St 53),"Kudos to them! ✌🏾,",0.0,,kudo,
Ace @ Work Childcare Pte Ltd (703 Choa Chu Kang St 53),wants to stay for the nap hour as well and likes the food.,0.2,,nap,
Ace @ Work Childcare (JE288B),My girl has been there since 2.5 years. Really appreciate the teachers effort in making it a fun and enjoyable place for both the kids and parents. The teachers organize events to involve parents too such as mother's day lunch and father's day Spartan race. My girl really love the school.,0.3,,girl,Educational Roles
Ace @ Work Childcare (JE288B),This shows how much of an impact the teacher has on the kids.,0.2,,impact,Educational Resources and Materials
Ace @ Work Childcare (JE288B),"Nevertheless, i hope ur centre and ur team continue to keep up the excellent service and reliable providing to the parents... you guys are doing great!.. All the best ladies and thank you for the love and concern showered on Reyniz.. we gonna missed u guys..",0.875,,guy,Educational Management and Organization
Ace @ Work Childcare (JE288B),GBTB as part of their learning experience,0.0,,learning,Learning and Teaching
Ace @ Work Childcare (JE288B),"Send my Son to playgroup 2020, can see his development progression in his speech, social and eating habits. I wld like to praise the teacher for their effort in educating my son and",0.03333333333333333,,development,
Ace @ Work Childcare (JE288B),their encouragement. Thank u very much.,0.26,,encouragement,Educational Resources and Materials
Aaytozee @ Hillview,"Contrary to other opinions,",-0.125,,opinion,Educational Management and Organization
Aaytozee @ Hillview, Please RECONSIDER sending your neurodivergent & neurotypical kids in all 7 ZEE group preschool. These are the reasons why;,0.0,,neurodivergent,
Aaytozee @ Hillview,2. Even though the teacher to student ratio is low.. I was able to noticed that the Teachers struggled to teach the class as there were MORE neurodivergent students compared to neurotypical and it was difficult to manage the class.,0.125,,student,Educational Roles
Aaytozee @ Hillview,Avoid at all cost!,0.0,,cost,
Aaytozee @ Hillview,and extremely high . No communication between teachers as well .,0.16,,communication,Communication in Education
7oaks Preschool - Bukit Batok,". What I like most is the canteen ,good enough for the student to get ready to P1 not like others pre - school where they eat,sleep and do activity in one place,",0.35,,canteen,
7oaks Preschool - Bukit Batok,Overall it's a good choice to send your kids to 7oaks pre-school.,0.35,,choice,
Active Learners,"My daughter enrol into active learner since 2018 and graduated in 2022. For the past 4 yrs, the teachers in active learner cared and taught her on various aspects of life eg clearing the table after meal, using the washroom etc. Basic math and english language were touch on to prepare her for primary school too.",-0.016666666666666656,,learner,
Agape Little Uni. @ Compassvale Pte Ltd,"Not recommended for malay and indian kids, mostly chinese teacher came from mainland china. Not really a local pre-school more to chinese pre-school. They teach chinese more then local language. Not recommended.",0.14285714285714285,,pre,
Al-Amin Education Pte Ltd,Send them at tour own risk. Both principal and teachers are those cant be bothered .,0.6,,tour,Educational Resources and Materials
Al-Amin Education Pte Ltd,This Yr 2024 Unexpected NO TRANSPORT SERVICE FOR PICK UP OUR KIDS & Then The School Admin Never Follow Up With Parents.,0.1,,yr,
Al-Amin Education Pte Ltd," Kind, giving & responsible caretakers to trust our cherished little ones with.. always there to ease parents' worries whenever required.",0.2041666666666667,,giving,
Ang Mo Kio Methodist Preschool,Chinese and numeracy curriculum too. I would highly recommend this preschool to anyone looking for a school for their kids!,0.1,,numeracy,Learning and Teaching
Ang Mo Kio Methodist Preschool,"Being in the church compound, there are well equipped classrooms and hall areas that are very conducive for learning and playing.",0.2,,church,Educational Institutions and Facilities
Ang Mo Kio Methodist Preschool,"I am also impressed on the comprehensive report prepared by the teachers with pictures as well,",1.0,,report,Educational Management and Organization
Ang Mo Kio Methodist Preschool," We have been very grateful for the education, curriculum, staff dedication at the school. Both my kids attend the kindergarten. The environment is trusting, staff / teacher / parent communication is clear and curriculum improvements are made regularly.",0.10000000000000002,,curriculum,Learning and Teaching
Ang Mo Kio Methodist Preschool," Amk Methodist preschool has provided my children with a well rounded education and prepared them with more than just primary school. They have instilled life skills and values to them such as diligence, independence and love for others. Thank you amk Methodist preschool!",0.38125,,preschool,
Ang Mo Kio Methodist Preschool," My 3 little ones thoroughly enjoyed school here. Their curriculum is well rounded including gym, art and computer classes in addition to their academic classes and outdoor play to not only prepare the little ones for primary school but also help in the development of their character and social skills.",0.07976190476190477,,one,
Ang Mo Kio Methodist Preschool, Nice place,0.6,,place,Educational Institutions and Facilities
Awwa Ltd (Kindle Garden Preschool),The owner of this school is my mom,0.0,,owner,Educational Roles
Baby Elk Infant Care Singapore,Will definitely recommend Baby Elk to anyone who is looking for an infant care around AMK/YCK area.,0.0,,infant,Students
Baby Elk Infant Care Singapore, there has been broader range of activities designed for children's development (and fun) - big thanks to Ms G! He will miss the teachers a lot!,0.2041666666666667,,range,Educational Management and Organization
Baby Elk Infant Care Singapore,"On the side note, the experience on the registration process in the beginning was not optimal so this can be an area of improvement (e.g. clarity of documents required)!",0.0,,note,Learning and Teaching
Baby Elk Infant Care Singapore, ** Updates: In response to the management's reply since I am unable to reply to it ** - 17th Sept 2020,-0.5,,update,Communication in Education
Baby Elk Infant Care Singapore,"Hi centre managers, thanks for your reply for this review. We noticed there are quite an amount of information which was left out in your reply. We will not pursue further, since you were adamant Baby Elk was entirely responsive, and you seem to be defensive against our constructive feedback.",0.06000000000000001,,reply,Communication in Education
Baby Elk Infant Care Singapore,"I can wink it off because like I said, as long as my baby is ok. Humans make mistake and I feel that there is no need to pinpoint all the nitty-gritty things. However, if the centre is so defensive that they are providing their best already, then I feel the need to highlight that these issues should not have occurred.",0.48333333333333334,,need,
Baby Elk Infant Care Singapore,"For my whatsapp review as screenshot by the centre,",0.0,,whatsapp,
Baby Elk Infant Care Singapore,"I felt that they should screenshot with the date as well because what I said was much earlier before this whole lapse of response. To be honest, even at this point in time,",0.26666666666666666,,date,Time in Education
Baby Elk Infant Care Singapore,"Prior to the recruitment, they were really pro-active in getting you to join. After which is a different story. There were many loopholes of unclear communications as well.",0.175,,recruitment,
Baby Elk Infant Care Singapore,"In terms of the educarers,",0.0,,term,
Baby Elk Infant Care Singapore,I think there are definitely room for improvement. But I understand that the role of the educarer is not easy and they are constantly short of teachers so many things I choose to wink off as long as my baby is not injured.,0.04666666666666667,,room,Educational Institutions and Facilities
Baby Elk Infant Care Singapore, There has been no problem with Baby Elk. They are very reponsive to our enquiries. We feel at ease leaving our baby girl in their care.,0.2,,problem,Educational Resources and Materials
Baby Elk Infant Care Singapore,"Hope EDCA can help with this teething issue,",0.0,,hope,
Baby Elk Infant Care Singapore,Caring and responsibility teachers at Baby Elks infant care.,0.0,,caring,Educational Management and Organization
Bedok Methodist Preschool SPARK Certification,"Wang laoshi,",0.0,,laoshi,
Bedok Methodist Preschool SPARK Certification,"Ms. Rey, and Mrs. Yeo, for their unwavering patience and guidance in helping my daughter reach her fullest potential. Bedok Methodist Preschool has been a wonderful choice for our family, and we couldn't be happier with the care and education they provide.",0.5,,patience,Emotions and Values in Education
Bedok Methodist Preschool SPARK Certification,Mathematics and Mandarin programmes.,0.0,,programme,Educational Management and Organization
Bedok Methodist Preschool SPARK Certification, BMPS is a faith based school that helped instill such core values,0.0,,faith,
Bedok Methodist Preschool SPARK Certification,& practices for my boys.,0.0,,practice,Educational Management and Organization
Bedok Methodist Preschool SPARK Certification," BMP puts serious thought and effort towards teaching and developing children, they are always open to feedback and to continuously improving. Highly recommended pre-school!",-0.04444444444444443,,thought,Educational Management and Organization
Bedok Methodist Preschool SPARK Certification, Excellent leadership and wonderful environment for a child!,1.0,,leadership,Educational Management and Organization
Bethesda (Ang Mo Kio) Kindergarten,Ms Chong and Yu Lao Shi for the assurance all these while. We are truly blessed to have all of you through their Kindy Journeys. God bless.,0.0,,assurance,
